### ISSUE TITLE
Crash in TcpReassembler? (SIGSEGV)

### ISSUE THREAD

**Issue by nagmtuc** [snort3/snort3#263]
At our university we are trying to setup new IDS servers running Snort3. Later they should replace the old ones running Snort2. Currently we have the problem that Snort crashes shortly after the start (approx. after 5-10 minutes) with a segmentation fault.

 - Snort version: 3.1.31.0
 - Lib DAQ version: 3.0.8
 - Enabled Rules: Pulled Pork (LightSPD)
 - Build from source on Debian Bullseye (Kernel 5.10.0-16-amd64)
 - Hardware
    - AMD EPYC 7352 24-Core Processor
    - 64 GB Memory

Commands to build `libdaq`:
```
./bootstrap
./configure
make
make install
```

Commands to build `snort`:
```
./configure_cmake.sh --enable-shell --enable-gdb --enable-tcmalloc
cd build
make
make install
```

Command to run snort:

`/usr/local/snort/bin/snort -v -M -c /usr/local/snort/etc/snort/snort.lua -z 4 -k none -l /var/log/snort - D -u local_snort -g local_snort -i bond0 -m 0x1b --create-pidfile -- plugin-path=/usr/local/pulledpork3/so_rules/`

We already found out that `snort` runs longer the lower the traffic is. Currently we have about 700MB/s (~800k Packets per second).

I already tried to find out where the error occurs. I checked several core dumps with `gdb` (not sure if this is the correct way, though):

1st:

```
root@marple:/var/snort-coredump# gdb /usr/local/snort/bin/snort core.snort.1001.2fe0a95b9e2e4b9493c951db55880f3a.1660.1657887320000000
GNU gdb (Debian 10.1-1.7) 10.1.90.20210103-git
Copyright (C) 2021 Free Software Foundation, Inc.
License GPLv3+: GNU GPL version 3 or later <http://gnu.org/licenses/gpl.html>
This is free software: you are free to change and redistribute it.
There is NO WARRANTY, to the extent permitted by law.
Type "show copying" and "show warranty" for details.
This GDB was configured as "x86_64-linux-gnu".
Type "show configuration" for configuration details.
For bug reporting instructions, please see:
<https://www.gnu.org/software/gdb/bugs/>.
Find the GDB manual and other documentation resources online at:
    <http://www.gnu.org/software/gdb/documentation/>.

For help, type "help".
Type "apropos word" to search for commands related to "word"...
Reading symbols from /usr/local/snort/bin/snort...
BFD: warning: /var/snort-coredump/core.snort.1001.2fe0a95b9e2e4b9493c951db55880f3a.1660.1657887320000000 is truncated: expected core file size >= 17766998016, found: 2147483648

warning: Can't open file socket:[18536] which was expanded to socket:[18536] during file-backed mapping note processing

warning: Can't open file socket:[27743] which was expanded to socket:[27743] during file-backed mapping note processing

warning: Can't open file socket:[35895] which was expanded to socket:[35895] during file-backed mapping note processing

warning: Can't open file socket:[34967] which was expanded to socket:[34967] during file-backed mapping note processing
[New LWP 1679]
[New LWP 1678]
[New LWP 1681]
[New LWP 1660]
[New LWP 1680]
Cannot access memory at address 0x7fc93f2fc088
Cannot access memory at address 0x7fc93f2fc080
Failed to read a valid object file image from memory.
Core was generated by `/usr/local/snort/bin/snort -v -M -c /usr/local/snort/etc/snort/snort.lua -z 4 -'.
Program terminated with signal SIGSEGV, Segmentation fault.
#0  0x000055fa3237af09 in TcpReassembler::flush_on_ack_policy (this=0x55fa3498e7a0, trs=..., p=0x55fa413a47e0)
    at /tmp/snort/snort/src/stream/tcp/tcp_reassembler.cc:1186
1186	            flags = get_reverse_packet_dir(trs, p);
[Current thread is 1 (LWP 1679)]
(gdb) thread 2
[Switching to thread 2 (LWP 1678)]
#0  0x000055fa323baa6b in AppIdDiscovery::do_application_discovery (p=0x55fa3e870240, inspector=..., odp_ctxt=..., tp_appid_ctxt=0x0)
    at /tmp/snort/snort/src/network_inspectors/appid/appid_discovery.cc:153
153	}
(gdb) thread 3
[Switching to thread 3 (LWP 1681)]
#0  0x00007fc93e96be86 in ?? ()
(gdb) thread 4
[Switching to thread 4 (LWP 1660)]
#0  0x00007fc93dd6ac61 in ?? ()
(gdb) thread 5
[Switching to thread 5 (LWP 1680)]
#0  0x000055fa323b9a71 in AppIdDiscovery::do_pre_discovery (p=0x55fa3f4890e0, asd=<error reading variable>, inspector=..., 
    protocol=<error reading variable>, outer_protocol=<optimized out>, direction=<optimized out>, odp_ctxt=...)
    at /tmp/snort/snort/src/network_inspectors/appid/appid_discovery.cc:279
279	        if (p->dsize)
(gdb)
```

2nd:

```
root@marple:/var/snort-coredump# gdb /usr/local/snort/bin/snort core.snort.1001.2fe0a95b9e2e4b9493c951db55880f3a.5263.1657887914000000 
GNU gdb (Debian 10.1-1.7) 10.1.90.20210103-git
Copyright (C) 2021 Free Software Foundation, Inc.
License GPLv3+: GNU GPL version 3 or later <http://gnu.org/licenses/gpl.html>
This is free software: you are free to change and redistribute it.
There is NO WARRANTY, to the extent permitted by law.
Type "show copying" and "show warranty" for details.
This GDB was configured as "x86_64-linux-gnu".
Type "show configuration" for configuration details.
For bug reporting instructions, please see:
<https://www.gnu.org/software/gdb/bugs/>.
Find the GDB manual and other documentation resources online at:
    <http://www.gnu.org/software/gdb/documentation/>.

For help, type "help".
Type "apropos word" to search for commands related to "word"...
Reading symbols from /usr/local/snort/bin/snort...
BFD: warning: /var/snort-coredump/core.snort.1001.2fe0a95b9e2e4b9493c951db55880f3a.5263.1657887914000000 is truncated: expected core file size >= 35274018816, found: 2147483648

warning: Can't open file socket:[66582] which was expanded to socket:[66582] during file-backed mapping note processing

warning: Can't open file socket:[21933] which was expanded to socket:[21933] during file-backed mapping note processing

warning: Can't open file socket:[61155] which was expanded to socket:[61155] during file-backed mapping note processing

warning: Can't open file socket:[16672] which was expanded to socket:[16672] during file-backed mapping note processing
[New LWP 5271]
[New LWP 5269]
[New LWP 5270]
[New LWP 5272]
[New LWP 5263]
Cannot access memory at address 0x7f3b80e21088
Cannot access memory at address 0x7f3b80e21080
Failed to read a valid object file image from memory.
Core was generated by `/usr/local/snort/bin/snort -v -M -c /usr/local/snort/etc/snort/snort.lua -z 4 -'.
Program terminated with signal SIGSEGV, Segmentation fault.
#0  0x000055eba39c4f09 in TcpReassembler::flush_on_ack_policy (this=0x55eba521c7a0, trs=..., p=0x55ebacc96480)
    at /tmp/snort/snort/src/stream/tcp/tcp_reassembler.cc:1186
1186	            flags = get_reverse_packet_dir(trs, p);
[Current thread is 1 (LWP 5271)]
(gdb) thread 2
[Switching to thread 2 (LWP 5269)]
#0  0x000055eba39a75ca in snort::Packet::get_snort_protocol_id (this=0x55ebaf12f9e0) at /tmp/snort/snort/src/protocols/packet.cc:255
255	}
(gdb) thread 3
[Switching to thread 3 (LWP 5270)]
#0  0x000055eba38be120 in std::vector<snort::IpsContext*, std::allocator<snort::IpsContext*> >::pop_back (this=<optimized out>)
    at /usr/include/c++/10/bits/stl_vector.h:1228
1228		--this->_M_impl._M_finish;
(gdb) thread 4
[Switching to thread 4 (LWP 5272)]
#0  0x000055eba3962f89 in snort::Flow::is_inspection_disabled (this=<optimized out>) at /tmp/snort/snort/src/flow/flow.h:361
361	    { return flags.disable_inspect; }
(gdb) thread 5
[Switching to thread 5 (LWP 5263)]
#0  0x00007f3b7f88fc61 in ?? ()
(gdb)
```

3rd:

```
root@marple:/var/snort-coredump# gdb /usr/local/snort/bin/snort core.snort.1001.2fe0a95b9e2e4b9493c951db55880f3a.13982.1657891435000000
GNU gdb (Debian 10.1-1.7) 10.1.90.20210103-git
Copyright (C) 2021 Free Software Foundation, Inc.
License GPLv3+: GNU GPL version 3 or later <http://gnu.org/licenses/gpl.html>
This is free software: you are free to change and redistribute it.
There is NO WARRANTY, to the extent permitted by law.
Type "show copying" and "show warranty" for details.
This GDB was configured as "x86_64-linux-gnu".
Type "show configuration" for configuration details.
For bug reporting instructions, please see:
<https://www.gnu.org/software/gdb/bugs/>.
Find the GDB manual and other documentation resources online at:
    <http://www.gnu.org/software/gdb/documentation/>.

For help, type "help".
Type "apropos word" to search for commands related to "word"...
Reading symbols from /usr/local/snort/bin/snort...
BFD: warning: /var/snort-coredump/core.snort.1001.2fe0a95b9e2e4b9493c951db55880f3a.13982.1657891435000000 is truncated: expected core file size >= 37522694144, found: 2147483648

warning: Can't open file socket:[25308] which was expanded to socket:[25308] during file-backed mapping note processing

warning: Can't open file socket:[55930] which was expanded to socket:[55930] during file-backed mapping note processing

warning: Can't open file socket:[78936] which was expanded to socket:[78936] during file-backed mapping note processing

warning: Can't open file socket:[17218] which was expanded to socket:[17218] during file-backed mapping note processing
[New LWP 14000]
[New LWP 13998]
[New LWP 13999]
[New LWP 14001]
[New LWP 13982]
Cannot access memory at address 0x7f047d73c088
Cannot access memory at address 0x7f047d73c080
Failed to read a valid object file image from memory.
Core was generated by `/usr/local/snort/bin/snort -v -M -c /usr/local/snort/etc/snort/snort.lua -z 4 -'.
Program terminated with signal SIGSEGV, Segmentation fault.
#0  0x000055997cb5bf09 in TcpReassembler::flush_on_ack_policy (this=0x55997e29c7a0, trs=..., p=0x55998913cc60)
    at /tmp/snort/snort/src/stream/tcp/tcp_reassembler.cc:1186
1186	            flags = get_reverse_packet_dir(trs, p);
[Current thread is 1 (LWP 14000)]
(gdb) thread 2
[Switching to thread 2 (LWP 13998)]
#0  0x000055997cc062f4 in snort::SfIp::is_set (this=0x55998912e8a2) at /tmp/snort/snort/src/sfip/sf_ip.h:172
172	    return ((family == AF_INET && ip32[3]) ||
(gdb) thread 3
[Switching to thread 3 (LWP 13999)]
#0  0x00007f047cdab59b in ?? ()
(gdb) thread 4
[Switching to thread 4 (LWP 14001)]
#0  0x000055997cc5a496 in BackOrifice::eval (this=<optimized out>, p=0x55998b13eb40)
    at /tmp/snort/snort/src/service_inspectors/back_orifice/back_orifice.cc:473
473	        if ( lookup2[key] == cyphertext_suffix )
(gdb) thread 5
[Switching to thread 5 (LWP 13982)]
#0  0x00007f047c1aac61 in ?? ()
(gdb) 
```

4th:

```
root@marple:/var/snort-coredump# gdb /usr/local/snort/bin/snort core.snort.1001.2fe0a95b9e2e4b9493c951db55880f3a.17478.1657892063000000 
GNU gdb (Debian 10.1-1.7) 10.1.90.20210103-git
Copyright (C) 2021 Free Software Foundation, Inc.
License GPLv3+: GNU GPL version 3 or later <http://gnu.org/licenses/gpl.html>
This is free software: you are free to change and redistribute it.
There is NO WARRANTY, to the extent permitted by law.
Type "show copying" and "show warranty" for details.
This GDB was configured as "x86_64-linux-gnu".
Type "show configuration" for configuration details.
For bug reporting instructions, please see:
<https://www.gnu.org/software/gdb/bugs/>.
Find the GDB manual and other documentation resources online at:
    <http://www.gnu.org/software/gdb/documentation/>.

For help, type "help".
Type "apropos word" to search for commands related to "word"...
Reading symbols from /usr/local/snort/bin/snort...
BFD: warning: /var/snort-coredump/core.snort.1001.2fe0a95b9e2e4b9493c951db55880f3a.17478.1657892063000000 is truncated: expected core file size >= 36123369472, found: 2147483648

warning: Can't open file socket:[90122] which was expanded to socket:[90122] during file-backed mapping note processing

warning: Can't open file socket:[91151] which was expanded to socket:[91151] during file-backed mapping note processing

warning: Can't open file socket:[23533] which was expanded to socket:[23533] during file-backed mapping note processing

warning: Can't open file socket:[72246] which was expanded to socket:[72246] during file-backed mapping note processing
[New LWP 17496]
[New LWP 17497]
[New LWP 17498]
[New LWP 17499]
[New LWP 17478]
Cannot access memory at address 0x7f1c4603e088
Cannot access memory at address 0x7f1c4603e080
Failed to read a valid object file image from memory.
Core was generated by `/usr/local/snort/bin/snort -v -M -c /usr/local/snort/etc/snort/snort.lua -z 4 -'.
Program terminated with signal SIGSEGV, Segmentation fault.
#0  0x000055ca32796f09 in TcpReassembler::flush_on_ack_policy (this=0x55ca345c27a0, trs=..., p=0x55ca3aada240)
    at /tmp/snort/snort/src/stream/tcp/tcp_reassembler.cc:1186
1186	            flags = get_reverse_packet_dir(trs, p);
[Current thread is 1 (LWP 17496)]
(gdb) thread 2
[Switching to thread 2 (LWP 17497)]
#0  0x000055ca326c1f7e in std::__detail::_Hashtable_base<std::__cxx11::basic_string<char, std::char_traits<char>, std::allocator<char> >, std::pair<std::__cxx11::basic_string<char, std::char_traits<char>, std::allocator<char> > const, std::vector<snort::DataHandler*, std::allocator<snort::DataHandler*> > >, std::__detail::_Select1st, std::equal_to<std::__cxx11::basic_string<char, std::char_traits<char>, std::allocator<char> > >, std::hash<std::__cxx11::basic_string<char, std::char_traits<char>, std::allocator<char> > >, std::__detail::_Mod_range_hashing, std::__detail::_Default_ranged_hash, std::__detail::_Hashtable_traits<true, false, true> >::_Equal_hash_code<std::__detail::_Hash_node<std::pair<std::__cxx11::basic_string<char, std::char_traits<char>, std::allocator<char> > const, std::vector<snort::DataHandler*, std::allocator<snort::DataHandler*> > >, true> >::_S_equals (
    __n=..., __c=<optimized out>) at /usr/include/c++/10/bits/hashtable_policy.h:1787
1787	       { return __c == __n._M_hash_code; }
(gdb) thread 3
[Switching to thread 3 (LWP 17498)]
#0  fp_search (port_group=<optimized out>, p=0x55ca40242c60, srvc=<optimized out>) at /tmp/snort/snort/src/detection/fp_detect.cc:960
960	    p->packet_flags &= ~PKT_FAST_PAT_EVAL;
(gdb) thread 4
[Switching to thread 4 (LWP 17499)]
#0  0x000055ca326973d2 in eval_nfp (port_group=0x55ca3aaabb80, p=0x55ca3c5659e0, ip_rule=0 '\000')
    at /tmp/snort/snort/src/detection/fp_detect.cc:1004
1004	    int8_t curr_ip_layer = 0;
(gdb) thread 5
[Switching to thread 5 (LWP 17478)]
#0  0x00007f1c44aacc61 in ?? ()
(gdb)
```

5th:

```
root@marple:/var/snort-coredump# gdb /usr/local/snort/bin/snort core.snort.1001.2fe0a95b9e2e4b9493c951db55880f3a.19724.1657892196000000 
GNU gdb (Debian 10.1-1.7) 10.1.90.20210103-git
Copyright (C) 2021 Free Software Foundation, Inc.
License GPLv3+: GNU GPL version 3 or later <http://gnu.org/licenses/gpl.html>
This is free software: you are free to change and redistribute it.
There is NO WARRANTY, to the extent permitted by law.
Type "show copying" and "show warranty" for details.
This GDB was configured as "x86_64-linux-gnu".
Type "show configuration" for configuration details.
For bug reporting instructions, please see:
<https://www.gnu.org/software/gdb/bugs/>.
Find the GDB manual and other documentation resources online at:
    <http://www.gnu.org/software/gdb/documentation/>.

For help, type "help".
Type "apropos word" to search for commands related to "word"...
Reading symbols from /usr/local/snort/bin/snort...
BFD: warning: /var/snort-coredump/core.snort.1001.2fe0a95b9e2e4b9493c951db55880f3a.19724.1657892196000000 is truncated: expected core file size >= 14115852288, found: 2147483648

warning: Can't open file socket:[32424] which was expanded to socket:[32424] during file-backed mapping note processing

warning: Can't open file socket:[56172] which was expanded to socket:[56172] during file-backed mapping note processing

warning: Can't open file socket:[88214] which was expanded to socket:[88214] during file-backed mapping note processing

warning: Can't open file socket:[64389] which was expanded to socket:[64389] during file-backed mapping note processing
[New LWP 19744]
[New LWP 19742]
[New LWP 19745]
[New LWP 19724]
[New LWP 19743]
Cannot access memory at address 0x7fc4e0ea1088
Cannot access memory at address 0x7fc4e0ea1080
Failed to read a valid object file image from memory.
Core was generated by `/usr/local/snort/bin/snort -v -M -c /usr/local/snort/etc/snort/snort.lua -z 4 -'.
Program terminated with signal SIGSEGV, Segmentation fault.
#0  0x0000563f71cde6c9 in TcpReassembler::scan_data_post_ack (this=0x563f72e667a0, trs=..., flags=0x7fc4dbe3303c, p=0x563f7e1797a0)
    at /tmp/snort/snort/src/stream/tcp/tcp_reassembler.cc:997
997	    if ( !trs.sos.seglist.cur_sseg || SEQ_GEQ(trs.sos.seglist_base_seq, trs.tracker->r_win_base) )
[Current thread is 1 (LWP 19744)]
(gdb) thread 2
[Switching to thread 2 (LWP 19742)]
#0  0x00007fc4e05d1565 in ?? ()
(gdb) thread 3
[Switching to thread 3 (LWP 19745)]
#0  0x0000563f71c0ead3 in snort::Mpse::search (this=0x563f7b03b800, batch=..., mpse_type=snort::Mpse::MPSE_TYPE_NORMAL)
    at /tmp/snort/snort/src/framework/mpse.cc:71
71	    _search(batch, mpse_type);
(gdb) thread 4
[Switching to thread 4 (LWP 19724)]
#0  0x00007fc4df90fc61 in ?? ()
(gdb) thread 5
[Switching to thread 5 (LWP 19743)]
#0  0x00007fc4e0a101cd in ?? ()
```

6th:

```
root@marple:/var/snort-coredump# gdb /usr/local/snort/bin/snort core.snort.1001.2fe0a95b9e2e4b9493c951db55880f3a.20030.1657892573000000 
GNU gdb (Debian 10.1-1.7) 10.1.90.20210103-git
Copyright (C) 2021 Free Software Foundation, Inc.
License GPLv3+: GNU GPL version 3 or later <http://gnu.org/licenses/gpl.html>
This is free software: you are free to change and redistribute it.
There is NO WARRANTY, to the extent permitted by law.
Type "show copying" and "show warranty" for details.
This GDB was configured as "x86_64-linux-gnu".
Type "show configuration" for configuration details.
For bug reporting instructions, please see:
<https://www.gnu.org/software/gdb/bugs/>.
Find the GDB manual and other documentation resources online at:
    <http://www.gnu.org/software/gdb/documentation/>.

For help, type "help".
Type "apropos word" to search for commands related to "word"...
Reading symbols from /usr/local/snort/bin/snort...
BFD: warning: /var/snort-coredump/core.snort.1001.2fe0a95b9e2e4b9493c951db55880f3a.20030.1657892573000000 is truncated: expected core file size >= 33717411840, found: 2147483648

warning: Can't open file socket:[76051] which was expanded to socket:[76051] during file-backed mapping note processing

warning: Can't open file socket:[93255] which was expanded to socket:[93255] during file-backed mapping note processing

warning: Can't open file socket:[70362] which was expanded to socket:[70362] during file-backed mapping note processing

warning: Can't open file socket:[79226] which was expanded to socket:[79226] during file-backed mapping note processing
[New LWP 20051]
[New LWP 20049]
[New LWP 20050]
[New LWP 20030]
[New LWP 20048]
Cannot access memory at address 0x7fd068764088
Cannot access memory at address 0x7fd068764080
Failed to read a valid object file image from memory.
Core was generated by `/usr/local/snort/bin/snort -v -M -c /usr/local/snort/etc/snort/snort.lua -z 4 -'.
Program terminated with signal SIGSEGV, Segmentation fault.
#0  0x00005556b9fa16c9 in TcpReassembler::scan_data_post_ack (this=0x5556bc9d47a0, trs=..., flags=0x7fd063ef703c, p=0x5556c46479e0)
    at /tmp/snort/snort/src/stream/tcp/tcp_reassembler.cc:997
997	    if ( !trs.sos.seglist.cur_sseg || SEQ_GEQ(trs.sos.seglist_base_seq, trs.tracker->r_win_base) )
[Current thread is 1 (LWP 20051)]
(gdb) thread 2
[Switching to thread 2 (LWP 20049)]
#0  0x00005556b9ec8a0e in (anonymous namespace)::mix (c=<synthetic pointer>: 1374289121, b=<synthetic pointer>: 3059508890, 
    a=<synthetic pointer>: 2370480496) at /tmp/snort/snort/src/hash/hash_key_operations.h:32
32	        c -= b; c ^= rot(b, 8); b += a;
(gdb) thread 3
[Switching to thread 3 (LWP 20050)]
#0  0x00005556b9f17130 in Analyzer::get_switcher () at /tmp/snort/snort/src/main/analyzer.cc:156
156	}
(gdb) thread 4
[Switching to thread 4 (LWP 20030)]
#0  0x00007fd0671d2c61 in ?? ()
(gdb) thread 5
[Switching to thread 5 (LWP 20048)]
#0  0x00007fd067dd362f in ?? ()
```

7th:

```
root@marple:/var/snort-coredump# gdb /usr/local/snort/bin/snort core.snort.1001.2fe0a95b9e2e4b9493c951db55880f3a.21305.1657892957000000 
GNU gdb (Debian 10.1-1.7) 10.1.90.20210103-git
Copyright (C) 2021 Free Software Foundation, Inc.
License GPLv3+: GNU GPL version 3 or later <http://gnu.org/licenses/gpl.html>
This is free software: you are free to change and redistribute it.
There is NO WARRANTY, to the extent permitted by law.
Type "show copying" and "show warranty" for details.
This GDB was configured as "x86_64-linux-gnu".
Type "show configuration" for configuration details.
For bug reporting instructions, please see:
<https://www.gnu.org/software/gdb/bugs/>.
Find the GDB manual and other documentation resources online at:
    <http://www.gnu.org/software/gdb/documentation/>.

For help, type "help".
Type "apropos word" to search for commands related to "word"...
Reading symbols from /usr/local/snort/bin/snort...
BFD: warning: /var/snort-coredump/core.snort.1001.2fe0a95b9e2e4b9493c951db55880f3a.21305.1657892957000000 is truncated: expected core file size >= 33227726848, found: 2147483648

warning: Can't open file socket:[76111] which was expanded to socket:[76111] during file-backed mapping note processing

warning: Can't open file socket:[87349] which was expanded to socket:[87349] during file-backed mapping note processing

warning: Can't open file socket:[80404] which was expanded to socket:[80404] during file-backed mapping note processing

warning: Can't open file socket:[83364] which was expanded to socket:[83364] during file-backed mapping note processing
[New LWP 21322]
[New LWP 21323]
[New LWP 21324]
[New LWP 21321]
[New LWP 21305]
Cannot access memory at address 0x7f636a580088
Cannot access memory at address 0x7f636a580080
Failed to read a valid object file image from memory.
Core was generated by `/usr/local/snort/bin/snort -v -M -c /usr/local/snort/etc/snort/snort.lua -z 4 -'.
Program terminated with signal SIGSEGV, Segmentation fault.
#0  0x0000563db436e6c9 in TcpReassembler::scan_data_post_ack (this=0x563db67147a0, trs=..., flags=0x7f6364d1103c, p=0x563dc0ecde60)
    at /tmp/snort/snort/src/stream/tcp/tcp_reassembler.cc:997
997	    if ( !trs.sos.seglist.cur_sseg || SEQ_GEQ(trs.sos.seglist_base_seq, trs.tracker->r_win_base) )
[Current thread is 1 (LWP 21322)]
(gdb) thread 2
[Switching to thread 2 (LWP 21323)]
#0  0x00007f636a0ef1cd in ?? ()
(gdb) thread 3
[Switching to thread 3 (LWP 21324)]
#0  0x00007f636908bcd9 in ?? ()
(gdb) thread 4
[Switching to thread 4 (LWP 21321)]
#0  0x00007f63694529b9 in ?? ()
(gdb) thread 5
[Switching to thread 5 (LWP 21305)]
#0  0x00007f6368feec61 in ?? ()
(gdb)
```

It looks like that the main thread crashes in a function in the class `TcpReassembler`:

- 1st - 4th: `TcpReassembler::flush_on_ack_policy` at `/tmp/snort/snort/src/stream/tcp/tcp_reassembler.cc:1186`
- 5th - 7th: `TcpReassembler::scan_data_post_ack` at `/tmp/snort/snort/src/stream/tcp/tcp_reassembler.cc:997`

**Comment by sminut** [comment]
I'll be looking into this, but to proceed, I need more information. For one, I would need access to the core files, so I can see the full backtrace and inspect some pointers. We would also need a pcap with the traffic that caused the crash. Also, I suspect the issue is single-threaded, not multi-threaded, so could you please run snort again with -z 1 instead of -z 4 and collect traffic e.g. with tcpdump? 

Please email me at sminut@cisco.com regarding this issue, it would be the fastest way to get to the bottom of it.

**Comment by hedayat** [comment]
I have a similar crash, and it seems that it is caused by infinite recursive call to `TcpReassembler::flush_on_ack_policy` at [line 1218 from snort3 version 35](https://github.com/snort3/snort3/blob/8dc4cff37ccfee30b75e385eb5b36cdcd384b976/src/stream/tcp/tcp_reassembler.cc#L1218):

```
#0  0x00005580a59ae146 in TcpReassembler::scan_data_post_ack (this=this@entry=0x5580a76e0a10, trs=..., flags=flags@entry=0x7f3836299044, p=p@entry=0x7f382a3df050)
    at ../../../../src/stream/tcp/tcp_reassembler.cc:1000
#1  0x00005580a59ae9cd in TcpReassembler::flush_on_ack_policy (this=0x5580a76e0a10, trs=..., p=0x7f382a3df050) at ../../../../src/stream/tcp/tcp_reassembler.cc:1195
#2  0x00005580a59aeab7 in TcpReassembler::flush_on_ack_policy (this=0x5580a76e0a10, trs=..., p=0x7f382a3df050) at ../../../../src/stream/tcp/tcp_reassembler.cc:1218
#3  0x00005580a59aeab7 in TcpReassembler::flush_on_ack_policy (this=0x5580a76e0a10, trs=..., p=0x7f382a3df050) at ../../../../src/stream/tcp/tcp_reassembler.cc:1218
#4  0x00005580a59aeab7 in TcpReassembler::flush_on_ack_policy (this=0x5580a76e0a10, trs=..., p=0x7f382a3df050) at ../../../../src/stream/tcp/tcp_reassembler.cc:1218
#5  0x00005580a59aeab7 in TcpReassembler::flush_on_ack_policy (this=0x5580a76e0a10, trs=..., p=0x7f382a3df050) at ../../../../src/stream/tcp/tcp_reassembler.cc:1218
#6  0x00005580a59aeab7 in TcpReassembler::flush_on_ack_policy (this=0x5580a76e0a10, trs=..., p=0x7f382a3df050) at ../../../../src/stream/tcp/tcp_reassembler.cc:1218
#7  0x00005580a59aeab7 in TcpReassembler::flush_on_ack_policy (this=0x5580a76e0a10, trs=..., p=0x7f382a3df050) at ../../../../src/stream/tcp/tcp_reassembler.cc:1218
... (exactly the same line (well, except the line number at the beginning!) is repeated)
```

I'd say `scan_data_post_ack` is not important, its just where the stack limit is reached. The real problem is infinite recursive calls to flush_on_ack_policy.

**Comment by snortadmin** [comment]
@hedayat - did you actually blow the stack? What does 'bt -1' print from gdb?

**Comment by hedayat** [comment]
I'll try to send the requested output soon, but yeah, I'm pretty sure. Commenting out the 'else if' block  apparently fixed the crash, although snort kept growing mem usage until killed because of OOM, which I don't know if it is related to removing those lines :)

**Comment by hedayat** [comment]
```
(gdb) bt -1
#102816 0x00007f5107bd1133 in clone () at ../sysdeps/unix/sysv/linux/x86_64/clone.S:95
```

**Comment by hedayat** [comment]
Probably more useful:

```
(gdb) bt -20
#102797 0x000055fd8ed36ab7 in TcpReassembler::flush_on_ack_policy (this=0x55fd906335c0, trs=..., p=0x7f509e3df050)
    at ../../../../src/stream/tcp/tcp_reassembler.cc:1218
#102798 0x000055fd8ed36ab7 in TcpReassembler::flush_on_ack_policy (this=0x55fd906335c0, trs=..., p=0x7f509e3df050)
    at ../../../../src/stream/tcp/tcp_reassembler.cc:1218
#102799 0x000055fd8ed36ab7 in TcpReassembler::flush_on_ack_policy (this=0x55fd906335c0, trs=..., p=0x7f509e3df050)
    at ../../../../src/stream/tcp/tcp_reassembler.cc:1218
#102800 0x000055fd8ed3a9f4 in TcpStateEstablished::ack_sent (this=<optimized out>, tsd=..., trk=...) at ../../../../src/stream/tcp/tcp_state_established.cc:68
#102801 0x000055fd8ed3c54c in TcpStateMachine::eval (this=0x55fd9049c500, tsd=...) at ../../../../src/stream/tcp/tcp_state_machine.cc:97
#102802 0x000055fd8ed397bf in TcpSession::process_tcp_packet (this=this@entry=0x7f4fe92b2fc0, tsd=..., p=p@entry=0x7f509e3df050)
    at ../../../../src/stream/tcp/tcp_session.cc:1106
#102803 0x000055fd8ed39e9e in TcpSession::process (this=0x7f4fe92b2fc0, p=0x7f509e3df050) at ../../../../src/stream/tcp/tcp_session.cc:1143
#102804 0x000055fd8ecd3279 in snort::InspectorManager::internal_execute<false> (p=p@entry=0x7f509e3df050) at ../../../src/protocols/packet.h:302
#102805 0x000055fd8eccf5e9 in snort::InspectorManager::execute (p=p@entry=0x7f509e3df050) at ../../../src/managers/inspector_manager.cc:2065
#102806 0x000055fd8ec33826 in snort::DetectionEngine::inspect (p=0x7f509e3df050) at ../../../src/detection/detection_engine.cc:626
#102807 0x000055fd8ecabf01 in process_packet (p=0x7f509e3df050) at ../../../src/main/analyzer.cc:206
#102808 process_packet (p=0x7f509e3df050) at ../../../src/main/analyzer.cc:190
#102809 0x000055fd8ecacb57 in Analyzer::process_daq_pkt_msg (this=this@entry=0x55fd97f93a00, msg=msg@entry=0x55fdfe61a160, retry=retry@entry=false)
    at ../../../src/main/analyzer.cc:405
#102810 0x000055fd8ecacd9e in Analyzer::process_daq_msg (this=0x55fd97f93a00, msg=0x55fdfe61a160, retry=<optimized out>) at ../../../src/main/analyzer.cc:427
#102811 0x000055fd8ecadfbd in Analyzer::process_messages (this=0x55fd97f93a00) at ../../../src/main/analyzer.cc:869
#102812 0x000055fd8ecae24b in Analyzer::analyze (this=this@entry=0x55fd97f93a00) at ../../../src/main/analyzer.cc:901
#102813 0x000055fd8ecae3f5 in Analyzer::operator() (this=0x55fd97f93a00, ps=0x55fd98f00120, run_num=<optimized out>) at ../../../src/main/analyzer.cc:744
#102814 0x00007f5107ee6de4 in ?? () from /lib/x86_64-linux-gnu/libstdc++.so.6
#102815 0x00007f5108e19609 in start_thread (arg=<optimized out>) at pthread_create.c:477
#102816 0x00007f5107bd1133 in clone () at ../sysdeps/unix/sysv/linux/x86_64/clone.S:95
```

**Comment by snortadmin** [comment]
Thanks, was after the number of stack frames. We will get back ASAP.

**Comment by sminut** [comment]
Oh, I think I see what's happening, it goes in flush_on_ack_policy(), then it goes into the trs.paf_state.paf == StreamSplitter::SKIP else if case, which sends it again into flush_on_ack_policy(). The call to skip_seglist_hole() should change state, but if for some reason it doesn't, then it goes again into flush_on_ack_policy(). Indefinitely. Yeah, the exact traffic that causes this would be very useful to understand what's wrong with skip_seglist_hole().

**Comment by hedayat** [comment]
Yeah, I forgot what -z0 does, but I doubt it has any effect; I also think the problem is in skip_seglist_hole().

About the pcap file and core dump, I'm not sure if I'm allowed to send. Tomorrow, I'll see what I can do.

**Comment by hedayat** [comment]
Unfortunately, I cannot send the traffic at least for now. However, I've put some debugging messages inside `skip_seglist_hole()`, the here is the output which is exactly repeated for each call to this function:

```
Entered(rcnt: 102774) with flash_amt: 0, is_paf: 0
trs.sos.seglist.head = true
trs.sos.seglist_base_seq = 928763760
Finish with: 
trs.tracker->rcv_nxt = 928763760
trs.sos.seglist.cur_rseg = 0x7f14ed794a90
```

I hope it sheds some light on the problem.

**Comment by sminut** [comment]
can I get at least the core file(s)?

**Comment by hedayat** [comment]
I'll get back to you about it. I'm need permission for it.

**Comment by hedayat** [comment]
Unfortunately, I can't send the dump too. BTW, if I could reproduce the problem with a sample traffic, I'll send it here.

**Comment by hedayat** [comment]
It also crashes with `-z 1`

**Comment by hedayat** [comment]
I spent some time debugging the code, and I don't know **how** the code is supposed to proceed at this point:

Control enters `flush_on_ack_policy()`, which calls `scan_data_post_ack()`, in which: `paf_initialized()` returns false, `has_seglisht_hole()` is true, and `flush_pt` is zero; effectively sets `flush_amt` to zero in `flush_on_ack_policy()` which breaks the loop and jumps to `skip_seglist_hole()` call. And since `flush_amt` is zero, `skip_seglist_hole()` doesn't do much to break the infinite recursive loop; and then `flush_on_ack_policy()` is recursively called.


My guess is that `flush_on_ack_policy()` should not be recursively called when flash_amt is zero, because in that case `trs.sos.seglist.head` doesn't change and `trs.sos.seglist.cur_rseg` also doesn't change, which cause infinite recursive calls.

**Comment by sminut** [comment]
In order for flush_on_ack_policy() to be called recursively, we'd need 

trs.paf_state.paf == SKIP

to be true in the if else clause on line 1215. That's what causes the recursion, not flush_amt. 

Now, the paf state is set via 

scan_data_post_ack() => has_seglist_hole() => ps.paf = StreamSplitter::SKIP;

That only happens if TcpReassembler thinks the seglist has a hole. The if () condition at the top of has_seglist_hole() is meant to determine whether the segment list has a a hole. If it doesn't, it returns false immediately. Otherwise, it signals that it has a hole by setting the state to SKIP. For some reason, it keeps thinking there is a hole there. 

If you could send the sample traffic you mentioned, it would be tremendously helpful. It probably has some condition that the reassembler doesn't handle properly. Right now, not having the exact traffic, I'm crafting my own, trying various combinations of missing tcp segments and acks, in the hope that one of those will trigger the crash.

If you are inclined to do your own debugging, step inside the TcpReassembler::has_seglist_hole() function and inspect the variables in the 

if ( ... )
   return false;

statement at the top of the function. If we understand why it keeps setting the paf  state to SKIP, then we can fix it.

**Comment by hedayat** [comment]
The reason I've mentioned `flush_amt`, is that because when it is zero, some parts of the code is skipped, like calling `purge_to_seq()`; and so `trs.sos.seglist.head` never changes and hence `trs.sos.seglist.cur_rseg` never changes. As a result, absolutely no progress is happening in these function calls, the same code with the same variables is being run again and again. 

And `has_seglist_hole()` changes `ps.paff` to `StreamSplitter::SKIP`; and `skip_seglist_hole()` changes it back to `StreamSplitter::START` (so, `paf_initialized()` always returns false in `scan_data_post_ack`. 

I'll send you the values of variables at top of `has_seglist_hole()`.

**Comment by hedayat** [comment]
These are logs from a number of initial recursive calls of a problematic case:

```
has_seglist_hole():
        tsn.prev: 0x7f4a4b3cbe30,
        tsn.prev->c_seq + tsn.prev->c_len: -1222322633, tsn.c_seq: -1222296641,
        trs.tracker->r_win_base: -1222293905

flush_pt = 15047

skip_seglist_hole():
        Entered(rcnt: 0) with flash_amt: 15047, is_paf: 0
        trs.sos.seglist.head = true
        trs.sos.seglist_base_seq = -1222322634
        Finish with:
        trs.tracker->rcv_nxt = -1222322634
        trs.sos.seglist.cur_rseg = 0x7f4a4b3cbe30


has_seglist_hole():
        tsn.prev: 0x7f4a4b3cbe30,
        tsn.prev->c_seq + tsn.prev->c_len: -1222322633, tsn.c_seq: -1222296641,
        trs.tracker->r_win_base: -1222293905

flush_pt = 0

skip_seglist_hole():
        Entered(rcnt: 1) with flash_amt: 0, is_paf: 0
        trs.sos.seglist.head = true
        trs.sos.seglist_base_seq = -1222322634
        Finish with:
        trs.tracker->rcv_nxt = -1222322634
        trs.sos.seglist.cur_rseg = 0x7f4a4b3cbe30

has_seglist_hole():
        tsn.prev: 0x7f4a4b3cbe30,
        tsn.prev->c_seq + tsn.prev->c_len: -1222322633, tsn.c_seq: -1222296641,
        trs.tracker->r_win_base: -1222293905

flush_pt = 0

skip_seglist_hole():
        Entered(rcnt: 2) with flash_amt: 0, is_paf: 0
        trs.sos.seglist.head = true
        trs.sos.seglist_base_seq = -1222322634
        Finish with:
        trs.tracker->rcv_nxt = -1222322634
        trs.sos.seglist.cur_rseg = 0x7f4a4b3cbe30

has_seglist_hole():
        tsn.prev: 0x7f4a4b3cbe30,
        tsn.prev->c_seq + tsn.prev->c_len: -1222322633, tsn.c_seq: -1222296641,
        trs.tracker->r_win_base: -1222293905

flush_pt = 0

skip_seglist_hole():
        Entered(rcnt: 3) with flash_amt: 0, is_paf: 0
        trs.sos.seglist.head = true
        trs.sos.seglist_base_seq = -1222322634
        Finish with:
        trs.tracker->rcv_nxt = -1222322634
        trs.sos.seglist.cur_rseg = 0x7f4a4b3cbe30

```

**Comment by sminut** [comment]
The debug output you posted above shows that has_seglist_hole() gets called with the exact same values, hence once it returns true, it keeps returning true (and setting the paf_state to SKIP), thus causing the infinite recursion. But it does not show WHY those values don't change.

Would it be possible to capture a pcap with the traffic that crashes snort, say, junk.pcap, then post the output of 

tcpdump -nnSr junk.pcap

This would look something like 

tcpdump -nnSr junk.pcap
reading from file junk.pcap, link-type EN10MB (Ethernet)
02:44:07.347778 IP 10.1.2.3.48620 > 10.9.8.7.8: Flags [S], seq 99, win 8192, length 0
02:44:07.347791 IP 10.9.8.7.8 > 10.1.2.3.48620: Flags [S.], seq 1, ack 100, win 8192, length 0
02:44:07.347798 IP 10.1.2.3.48620 > 10.9.8.7.8: Flags [.], ack 2, win 8192, length 0
02:44:07.347808 IP 10.1.2.3.48620 > 10.9.8.7.8: Flags [.], seq 100:110, ack 2, win 8192, length 10
02:44:07.347813 IP 10.9.8.7.8 > 10.1.2.3.48620: Flags [.], ack 110, win 8192, length 0
02:44:07.347828 IP 10.1.2.3.48620 > 10.9.8.7.8: Flags [.], seq 115:130, ack 2, win 8192, length 15
02:44:07.347837 IP 10.9.8.7.8 > 10.1.2.3.48620: Flags [.], ack 140, win 8192, length 0
02:44:07.347846 IP 10.1.2.3.48620 > 10.9.8.7.8: Flags [.], seq 140:150, ack 2, win 8192, length 10
02:44:07.347851 IP 10.9.8.7.8 > 10.1.2.3.48620: Flags [.], ack 150, win 8192, length 0
02:44:07.347858 IP 10.1.2.3.48620 > 10.9.8.7.8: Flags [F.], seq 150, ack 2, win 8192, length 0
02:44:07.347864 IP 10.9.8.7.8 > 10.1.2.3.48620: Flags [F.], seq 2, ack 151, win 8192, length 0
02:44:07.347870 IP 10.1.2.3.48620 > 10.9.8.7.8: Flags [.], ack 3, win 8192, length 0

I don't need to see the data in the packets, only the seq and ack numbers. Of course, you'd have to extract the exact flow that produces the crash (e.g. with wireshark), and for that you'd need to find in snort the packet number where it starts recursing. You can also edit the IP addresses if that's a privacy concern. 



This is what I understand from your output and especially from the source code.

We are in TcpReassembler::scan_data_post_ack() at [line 1045](https://github.com/snort3/snort3/blob/8dc4cff37ccfee30b75e385eb5b36cdcd384b976/src/stream/tcp/tcp_reassembler.cc#L1045)

```
        if ( has_seglist_hole(trs, *tsn, trs.paf_state, total, *flags) )
            flush_pt = total;
```

We call has_seglist_hole() and based on your first output, by converting the negative integers to unsigned, the if() clause at the top of has_seglist_hole() is false, so has_seglist_hole() sets paf_state = SKIP and returns false. Back to line 1045, this if() is true and flush_pt = total.

Next, on [line 1058](https://github.com/snort3/snort3/blob/8dc4cff37ccfee30b75e385eb5b36cdcd384b976/src/stream/tcp/tcp_reassembler.cc#L1058) 

```
        if ( flush_pt >= 0 )
        {
            trs.sos.seglist_base_seq = trs.sos.seglist.cur_rseg->c_seq;
            return flush_pt;
        }
```

we return flush_pt = 15047, based on the debug output. 

Now, back in flush_on_ack_policy, flush_amt = 15047 and trs.paf_state = SKIP upon return from scan_data_post_ack(). Then we call skip_seglist_hole() on [line 1215](https://github.com/snort3/snort3/blob/8dc4cff37ccfee30b75e385eb5b36cdcd384b976/src/stream/tcp/tcp_reassembler.cc#L1215) which changes the paf state to START, and then we call flush_on_ack_policy() again:
```
        else if ( trs.paf_state.paf == StreamSplitter::SKIP )
        {
            skip_seglist_hole(trs, p, flags, flush_amt);
            return flush_on_ack_policy(trs, p);
        }
```
 
So again 

flush_on_ack_policy() => scan_data_post_ack() => has_seglist_hole(). 

As before, has_seglist_hole() sets the paf_state = SKIP and returns false. This can be seen from the debug output (2nd time) but it also HAS to set the paf_state to SKIP (and return true) if we recurse, as that is the ONLY function that sets paf_state = SKIP. Without SKIP, we would not recurse. As a result, again, flush_pt = total, and based on the debug output, flush_pt = total = 0. The reason total = 0 is because upon re-entry to flush_on_data_policy(), paf_state = START, as set by skip_seglist_hole(), which makes paf_initialized() return false in scan_data_post_ack() (as you've already noticed):

```
    uint32_t total = 0;
    TcpSegmentNode* tsn = trs.sos.seglist.cur_sseg;
    if ( paf_initialized(&trs.paf_state) )
    {
        uint32_t end_seq = tsn->c_seq + tsn->c_len;
        if ( SEQ_EQ(end_seq, paf_position(&trs.paf_state)) )
        {
            total = end_seq - trs.sos.seglist_base_seq;
            tsn = tsn->next;
        }
        else
            total = tsn->c_seq - trs.sos.seglist.cur_rseg->c_seq;
    }
```

Hence, the 2nd time around, scan_data_pre_ack() returns flush_amt = 0 and paf_state = SKIP. 

The question is why does has_seglist_hole() keep getting called with the exact same values.

**Comment by hedayat** [comment]
Thank you for your explanation. I'll try to see if I can extract the problematic flow.

Yeah, I get you that flush_amt = 0 is not the cause but a result of the problem. From what I get from successful (with finite recursion) like this:
```
has_seglist_hole():
        tsn.prev: 0x7f4a766a39b0,
        tsn.prev->c_seq + tsn.prev->c_len: -1233884724, tsn.c_seq: -1233884664,
        trs.tracker->r_win_base: -1233883204

flush_pt = 1448

skip_seglist_hole():
        Entered(rcnt: 0) with flash_amt: 1448, is_paf: 1
        trs.sos.seglist.head = true
        trs.sos.seglist_base_seq = -1233884664
        Finish with:
        trs.tracker->rcv_nxt = -1233884664
        trs.sos.seglist.cur_rseg = 0x7f4a766b1580
```

The problem seems to be that in successful calls, the value of `trs.sos.seglist.cur_rseg` is different from `tsn.prev` in `has_seglist_hole()`; but in the problematic case these are same.

I'll try to investigate further, and possibly extract the problematic flow.

**Comment by sminut** [comment]
seglist is a linked list of tcp segments that snort has received and it's trying to reassemble into a single buffer, that will be inspected by protocol-specific inspectors like http, ftp, smb, etc. 

If the seglist has a hole, we call skip_seglist_hole() because the inspectors need to have contiguous data. 

In skip_seglist_hole(), if flush_amt > 0 then we call purge_to_seq(), which advances the seglist.head to the right end of the hole. Then, we call flush_on_ack_policy() recursively, and then scan and check again for holes in seglist, with has_seglist_hole(). 

We are now the 2nd time through the loop. Since we've advanced the seglist.head in purge_to_seq() on the first iteration, tsn should point to seglist.head, and tsn.prev should be NULL. In this case, has_seglist_hole() will return early (false), indicating there is no hole.

This is what I don't understand: based on your debug output, flush_pt (hence flush_amt too) is > 0 on the first pass, yet tsn.prev != nullptr the 2nd time through has_seglist_hole().

We need to see what happens inside skip_seglist_hole.

Can you put cerr statements in each if / else block inside skip_seglist_hole(), so we can see exactly which path it takes in there? 

Also print flush_amt and trs.sos.seglist (head, tail, cur_rseg, cur_sseg, count) at the very beginning of skip_seglist_hole() and at the very end. We need to figure out which path it takes in skip_seglist_hole() that does not change the seglist.

You can put something like 

```
#include <iostream>

#define WhereMacro __FILE__ << ": line: " << __LINE__ << ": " << __FUINCTION__
```
at the top of tcp_reassembler.cc and call 

```
cerr << WhereMacro << ": " << ... 
```
wherever you need to print stuff in the code.


Of course, if you've captured a pcap with the crash, you can do all this in gdb like this:

https://stackoverflow.com/questions/5941158/gdb-print-to-file-instead-of-stdout

**Comment by sminut** [comment]
Can you please recompile snort with the attached tcp_reassembler.cc? I added some debug statements with variables that are relevant to the current issue.

Everything I added goes to stderr, so when you run snort please redirect stderr to a file, e.g.

snort [options] 2>snort.err

then send me snort.err. I’m only printing pointer values and local variables, no packet data, etc. much like you printed on GitHub, so privacy should not be an issue.

Thanks!


Sent from Mail<https://go.microsoft.com/fwlink/?LinkId=550986> for Windows

**Comment by hedayat** [comment]
Yeah, sure, I can do it in a day or two (also replying to your previous message); but there is a small problem I don't see any attachment to your last comment. :P

**Comment by nagmtuc** [comment]
@hedayat, thanks for your reply. I thought it was just me not seeing the attachment 😂 as soon as we have we will

**Comment by sminut** [comment]
I don't know how to attach a file in github or if it's possible, so I replied via regular email with the attachment, but that probably that didn't reach your email. I'll try to find another way to send it.

**Comment by hedayat** [comment]
Yeah, this happens as we look for an "Attach" button, but there is none :)

Look at the bar below the text box where we write our comments. You can either click on the bar, or more easily just drag the file and drop it in the box. It'll be attached.

**Comment by sminut** [comment]
[tcp_reassembler.cc.gz](https://github.com/snort3/snort3/files/9268871/tcp_reassembler.cc.gz)

Thank you for the tip, I would have never seen that! 

I had to gzip the file, because github does not support .cc type.

**Comment by hedayat** [comment]
Well, things are getting even more weird. The last time I added more debugging messages, I felt that it tooks longer for snort to crash, but I thought I might be completely wrong. But now, as I've used your source with lots of logging, the code no longer crashes (actually, once it crashed, but not in the context we are talking!). Since I'm running snort with `-z 1`, is there any other code path which might run concurrently?

There is also another issue. Even before using your code, I tried to extract the problematic flow. Or even a part of the pcap which is problematic. Note that until now, I didn't run snort on the pcap file; instead I replayed the pcap file using `tcpreplay -l0` and run snort on that interface to get the crash. Trying to extract the problematic traffic/flow, there was this surprising observation:

1. Running snort over the pcap file using `-r <pcap_f>` didn't result in a crash
2. I played the pcap over an interface and run snort over it; at the same time I captured the traffic using `tcpdump` till snort crashed. Running snort over the last GBs of newly captured .pcap file *didn't* result in a crash.

Both above observations seem to suggest that the situation is not deterministic. Is it possible? I've not digged into the code to see if it is at all possible.

**Comment by sminut** [comment]
When you say it doesn't crash with -r <pcap> is that with my debug code or with the original github code?

Also, if you're trying to find the flow that leads to the crash, you can figure it out from the core file, if you print in gdb 

(gdb) p snort::pc.analyzed_pkts

That would show you the packet number that is being processed. Then, in wireshark, you can go to that packet number, follow the tcp stream and save. 

If you do that, then please describe exactly how you're running snort, the configuration and whatever you can post from the extracted pcap. I didn't know you were replaying the pcap on an interface with tcpreplay -l0.

**Comment by hedayat** [comment]
> When you say it doesn't crash with -r is that with my debug code or with the original github code?

It doesn't crash even with the original github code.

> That would show you the packet number that is being processed. Then, in wireshark, you can go to that packet number, follow the tcp stream and save.

OK, but I wonder since (apparently) the crash won't happen again in the same exact position, the packet number would be of any use.

> If you do that, then please describe exactly how you're running snort, the configuration and whatever you can post from the extracted pcap. I didn't know you were replaying the pcap on an interface with tcpreplay -l0.

Yeah, sure.

> Oh, and if you want to make snort (more) deterministic, use -H -U on the command line.

Thanks for the pointer

**Comment by sminut** [comment]
Would it be possible to do a video call? It would be much faster. 

The crash is not e.g. a segfault, it happens because the stack is exhausted, which in turn happens because of the infinite recursion. Once it goes into the recursion the packet number won't change. I want the flow containing that packet.

Since you're saying you don't see the problem with my very verbose code, I'm wondering if we could instead detect the infinite recursion and only print the relevant info at that point, rather than on every single packet. 

If we call skip_seglist_hole() with flush_amt = 0 and paf_state = SKIP, then we remain in that state, i.e. we keep calling skip_seglist_hole() with the same exact trs and tsd, thus causing the recursion. Like crossing the event horizon of a black hole. We could just print the debug output when that happens, find the packet number, extract the flow, etc.

**Comment by hedayat** [comment]
> Would it be possible to do a video call? It would be much faster.

That's possible, although I'm not sure that we can find an appropriate time for both of us :) Hmmm... maybe we can find sometime tomorrow. Which time range in UTC is good for you? (If you think it is still beneficial to have a call).

 

> Once it goes into the recursion the packet number won't change. I want the flow containing that packet.

Yeah, I understand. But as I said before, apparently it doesn't happen on a specific flow every time. So, the flow number might be actually random for each run! As I said before, running snort over the pcap file using `-r` would not result in any crashes. But playing the same traffic over and over again will **ultimately** result in a crash... which might even related to extra traffic (beside the one I'm playing) which participate in causing the crash. And, I can't record all the traffic up to the crash since sometimes it takes a long time to crash. But, I'll try a number of times to see if I can have an early crash (surprisingly I don't get early crashes now that I need it!). 



> We could just print the debug output when that happens, find the packet number, extract the flow, etc.

Yeah, it should work. I'll try it. I thought you'll need the logs which lead to the recursion, which seems to be hard to get. I'll still try the full debugging version, it might still crash in the long run although I should do something about having a very big log file.

**Comment by hedayat** [comment]
OK, I was wrong. It was able to crash even with full debugging (your code) enabled :). I cut initial logs, but I believe I've kept enough logs before the crash; but still if you think you'll need earlier logs tell me to send them for you. Luckily, the logs compress very well. (Sorry for double compression, it turns out that github doesn't accept .xz files, so I gzipped it again :) )

[my.log.xz.gz](https://github.com/snort3/snort3/files/9337606/my.log.xz.gz)

**Comment by sminut** [comment]
So it seems that it starts to recurse on line 880999 in my.log. At that point has_seglist_hole() is called with total = 0 (hence paf_initialized() returned false, so paf state was START) and a gap is detected:

################################# BEGIN has_seglist_hole ###################################                                                                  
                                                                                                                                                              
../../../../src/stream/tcp/tcp_reassembler.cc: 1043: has_seglist_hole                                                                                         
        total: 0                                                                                                                                              
        head: 0x7fd249c364d0, tail: 0x7fd24b048f90, rseg: 0x7fd24b048f90, sseg: 0x7fd24b048f90, count: 3058                                                   
        seglist_base_seq: 3705875589                                                                                                                          
         H: prev: 0, next: 0x7fd24af57000, i_seq: 1319448345, i_len: 1448, c_seq: 1319448345, c_len: 1448, off: 0, sz: 1460                                   
         T: prev: 0x7fd24047fdc0, next: 0, i_seq: 3705875589, i_len: 52, c_seq: 3705875589, c_len: 52, off: 0, sz: 52                                         
        CR: prev: 0x7fd24047fdc0, next: 0, i_seq: 3705875589, i_len: 52, c_seq: 3705875589, c_len: 52, off: 0, sz: 52                                         
        CS: prev: 0x7fd24047fdc0, next: 0, i_seq: 3705875589, i_len: 52, c_seq: 3705875589, c_len: 52, off: 0, sz: 52                                         
                                                                                                                                                              
        prev: 0x7fd24047fdc0, next: 0, i_seq: 3705875589, i_len: 52, c_seq: 3705875589, c_len: 52, off: 0, sz: 52                                             
                                                                                                                                                              
../../../../src/stream/tcp/tcp_reassembler.cc: 1067: has_seglist_hole:                                                                                        
        return: has gap                                                                                                                                       
################################# END has_seglist_hole ###################################                                                                    
                                                                                            

The sequence number is 3705875589. Can you do this:

tcpdump -nnSr <your.pcap> tcp | grep 3705875589

Get the source / destination IPs and source / destination ports Then extract the flow between those hosts:

tcpdump -nnSr <your.pcap> host <src_ip> and port <src_port> and host <dst_ip> and port <dst_port> -w out.pacp

Now out.pcap should contain the exact flow that triggers the bug. Run snort again on out.pcap (with and without the debug output) and see if it crashes.

**Comment by hedayat** [comment]
Well, I was hoping that the log would provide sufficient info. No, as I said before, snort doesn't crash in a specific position. I mean, at least as much as I tried, it never crashed when I ran it over the pcap file directly using `-r`. I played the pcap file over an actual interface using `tcpreplay -l0 -ieth0 mypcap.pcap`, and I didn't capture the traffic from the interface into a new pcap file (because, it can take a long time before it crashes). 

But, what will happen if I can actually extract the flow? Well, I'd guess it is likely that it doesn't crash (But I'm not sure). 

Well, I'll try to make snort crash again, and will capture the actual traffic from the interface. Although, I'm forced to make tcpdump to rotate captured files so that it doesn't fill the disk; I hope that the traffic in which snort crashes will be captured completely (I hope it's not a long running flow).

**Comment by sminut** [comment]
What I'm saying is that if you extract the flow that crashed it, from mypcap.pcap (say extracted.pcap), then repeat the experiment with extracted.pcap. This means, replay extracted.pcap with

tcpreplay -l0 -ieth0 extracted.pcap

instead of mypcap.pcap and run snort exactly like you did before. 

The idea is to see if we can isolate the issue, so we must do whatever you did to crash it in the first place, but with only the flow that we saw in the debug output. You do not need to capture what goes through snort. And the debug output on extracted.pcap should be much smaller than the output of mypcap.pcap.

**Comment by hedayat** [comment]
Yeah, the problem was that this:
`tcpdump -nnSr <your.pcap> tcp | grep 3705875589`

didn't result in any output. There was no such sequence number in my pcap file. Hmm.... I don't know if tcpreplay provides its own sequence numbers? If not, it means that the problematic flow was not in that pcap file in the first place right?

**Comment by sminut** [comment]
How can there be a seq number 3705875589 in snort, and not be one in the pcap? 

How exactly are you running snort? 

On machine A: 
tcpreplay -l0 -ieth0 mypcap.pcap

and on machine B:
snort -c snort.lua ... 

What exactly is the snort command on machine B?

**Comment by hedayat** [comment]
> How can there be a seq number 3705875589 in snort, and not be one in the pcap?

Well, maybe it was an external flow running at the same time. Although the machine was not expected to have any kind of significant traffic.



> On machine A

Oops, apparently I should exactly describe how I run snort. First of all, I run both commands in the same machine. So, we have a single machine in which I run:

```
tcpreplay -ienp1s0 -l0 /path/to/my.pcap
```

And in the same machine, I also run snort:
```
/usr/bin/snort -c /etc/snort/my.snort.lua -A alert_syslog --lua 'alert_syslog = { facility = "local5" }' --plugin-path /var/lib/snort/talos/so_rules/ -z 1
```

You're probably interested in the config too. I'll attach config dump here soon.

**Comment by sminut** [comment]
Thanks, we've reproduced the crash on our side some time this past weekend, after we saw you're replaying the pcap with tcpdump -l0. We are working on a fix. I'm in gdb right now, right when it's about to start the infinite recursion, trying to figure out how this case should be handled.

**Comment by hedayat** [comment]
Oh nice! Thanks. I was thinking about digging into the debugger/logs myself too. Happy to hear that you could finally reproduce the problem :)

**Comment by nagmtuc** [comment]
Any update @sminut? As you wrote you were able to reproduce the issue and are working on a fix, we stopped our effort to reproduce it with dummy data (which we could provide as pcap). Do you need any input from our side?

**Comment by nagmtuc** [comment]
I tried with most recent version of `libdaq` and `snort`. The problem persists. Can we support you in any way to solve this issue?

**Comment by jaliimra** [comment]
@nagmtuc If you could provide us with a pcap for repro, that would be great.

**Comment by nagmtuc** [comment]
Unfortunately, I cannot provide a pcap, as this would contain the traffic of our university members (staff & students). This would violate our privacy regulations. We tried to reproduce the error with dummy traffic in a lab environment, without success. As @sminut wrote earlier, the problem might be related to sequence numbers. Would it help to parse a failing pcap file to extract IP addresses (and obfuscate them) together with sequence numbers and provide this?

**Comment by luxifer** [comment]
I was able to pinpoint to a specific packet in a pcap where snort segfault. Replaying only the packet does not make snort segfaul. And same issue as @nagmtuc. It's traffic from a customer hence we can't share it.

**Comment by nagmtuc** [comment]
@luxifer, can you extract the complete communication that belongs to the failing packet and try to replay this?

**Comment by snortadmin** [comment]
We have a reproduction and are working on a fix.

**Comment by vdechenaux** [comment]
I think this one has been fixed in https://github.com/snort3/snort3/commit/47519fd4f5dc45b92e56ed3d0d34829ccedb19d7, correct ?

**Comment by nagmtuc** [comment]
Good news. I will recompile tomorrow and see if we encounter any issues over the weekend. I will give a feedback on Monday.

**Comment by snortadmin** [comment]
@vdechenaux, yes, that commit should fix it.

@nagmtuc, any luck?

**Comment by nagmtuc** [comment]
Unfortunately, not. We had 5 crashes since Friday.

~~~
# /usr/local/snort/bin/snort -V

   ,,_     -*> Snort++ <*-
  o"  )~   Version 3.1.56.0
   ''''    By Martin Roesch & The Snort Team
           http://snort.org/contact#team
           Copyright (C) 2014-2023 Cisco and/or its affiliates. All rights reserved.
           Copyright (C) 1998-2013 Sourcefire, Inc., et al.
           Using DAQ version 3.0.11
           Using LuaJIT version 2.1.0-beta3
           Using OpenSSL 1.1.1n  15 Mar 2022
           Using libpcap version 1.10.0 (with TPACKET_V3)
           Using PCRE version 8.39 2016-06-14
           Using ZLIB version 1.2.11
           Using Hyperscan version 5.4.0 2021-01-26
           Using LZMA version 5.2.5
~~~

I checked the last core dump:

~~~
# gdb /usr/local/snort/bin/snort core.snort.1001.8a25086105864b24baf65b39e544c00f.643191.1678096992000000
GNU gdb (Debian 10.1-1.7) 10.1.90.20210103-git
Copyright (C) 2021 Free Software Foundation, Inc.
License GPLv3+: GNU GPL version 3 or later <http://gnu.org/licenses/gpl.html>
This is free software: you are free to change and redistribute it.
There is NO WARRANTY, to the extent permitted by law.
Type "show copying" and "show warranty" for details.
This GDB was configured as "x86_64-linux-gnu".
Type "show configuration" for configuration details.
For bug reporting instructions, please see:
<https://www.gnu.org/software/gdb/bugs/>.
Find the GDB manual and other documentation resources online at:
    <http://www.gnu.org/software/gdb/documentation/>.

For help, type "help".
Type "apropos word" to search for commands related to "word"...
Reading symbols from /usr/local/snort/bin/snort...
BFD: warning: /tmp/core.snort.1001.8a25086105864b24baf65b39e544c00f.643191.1678096992000000 is truncated: expected core file size >= 22671872000, found: 2147483648

warning: Can't open file socket:[1765479] which was expanded to socket:[1765479] during file-backed mapping note processing
[New LWP 643196]
[New LWP 643191]
Cannot access memory at address 0x7fed8eee7088
Cannot access memory at address 0x7fed8eee7080
Failed to read a valid object file image from memory.
Core was generated by `/usr/local/snort/bin/snort -v -M -c /usr/local/snort/etc/snort/snort.lua -z 1 -'.
Program terminated with signal SIGSEGV, Segmentation fault.
#0  0x00005648e7fa1506 in TcpReassembler::scan_data_post_ack (this=0x5648ea39a7d0, trs=..., flags=0x7fed89af402c, p=0x5648f1c98b40) at /tmp/snort/snort/src/stream/tcp/tcp_reassembler.cc:1004
1004	    if ( !trs.sos.seglist.cur_sseg || SEQ_GEQ(trs.sos.seglist_base_seq, trs.tracker->r_win_base) )
[Current thread is 1 (LWP 643196)]
(gdb) thread 2
[Switching to thread 2 (LWP 643191)]
#0  0x00007fed8d942561 in ?? ()
~~~

**Comment by snortadmin** [comment]
Argh. Thanks for checking. It looks the same. To be sure, can you try the command 'bt -1' in gdb?

**Comment by nagmtuc** [comment]
Not sure if you still need it after your "edit"-message, bur here is the output of the `bt -1` command in `gdb` from a core dump 5 minutes ago:

~~~
# gdb /usr/local/snort/bin/snort core.snort.1001.8d42d92cd71147c7a8490e97627727a4.107099.1678199330000000
GNU gdb (Debian 10.1-1.7) 10.1.90.20210103-git
Copyright (C) 2021 Free Software Foundation, Inc.
License GPLv3+: GNU GPL version 3 or later <http://gnu.org/licenses/gpl.html>
This is free software: you are free to change and redistribute it.
There is NO WARRANTY, to the extent permitted by law.
Type "show copying" and "show warranty" for details.
This GDB was configured as "x86_64-linux-gnu".
Type "show configuration" for configuration details.
For bug reporting instructions, please see:
<https://www.gnu.org/software/gdb/bugs/>.
Find the GDB manual and other documentation resources online at:
    <http://www.gnu.org/software/gdb/documentation/>.

For help, type "help".
Type "apropos word" to search for commands related to "word"...
Reading symbols from /usr/local/snort/bin/snort...
BFD: warning: /tmp/core.snort.1001.8d42d92cd71147c7a8490e97627727a4.107099.1678199330000000 is truncated: expected core file size >= 64819994624, found: 2147483648

warning: Can't open file socket:[417275] which was expanded to socket:[417275] during file-backed mapping note processing
[New LWP 107105]
[New LWP 107099]
Cannot access memory at address 0x7f0622b92088
Cannot access memory at address 0x7f0622b92080
Failed to read a valid object file image from memory.
Core was generated by `/usr/local/snort/bin/snort -v -M -c /usr/local/snort/etc/snort/snort.lua -z 1 -'.
Program terminated with signal SIGSEGV, Segmentation fault.
#0  0x000055c6a9775502 in TcpReassembler::scan_data_post_ack (this=0x55c6aafe07d0, trs=..., flags=0x7f061d79f01c, p=0x55c6b1508b40)
    at /tmp/snort/snort/src/stream/tcp/tcp_reassembler.cc:1004
1004	/tmp/snort/snort/src/stream/tcp/tcp_reassembler.cc: Datei oder Verzeichnis nicht gefunden.
[Current thread is 1 (LWP 107105)]
(gdb) bt -1
#0  0x000055c6a9775502 in TcpReassembler::scan_data_post_ack (this=0x55c6aafe07d0, trs=..., flags=0x7f061d79f01c, p=0x55c6b1508b40)
    at /tmp/snort/snort/src/stream/tcp/tcp_reassembler.cc:1004
Backtrace stopped: Cannot access memory at address 0x7f061d79f008
(gdb) thread 1
[Switching to thread 1 (LWP 107105)]
#0  0x000055c6a9775502 in TcpReassembler::scan_data_post_ack (this=0x55c6aafe07d0, trs=..., flags=0x7f061d79f01c, p=0x55c6b1508b40)
    at /tmp/snort/snort/src/stream/tcp/tcp_reassembler.cc:1004
1004	in /tmp/snort/snort/src/stream/tcp/tcp_reassembler.cc
(gdb) bt -1
#0  0x000055c6a9775502 in TcpReassembler::scan_data_post_ack (this=0x55c6aafe07d0, trs=..., flags=0x7f061d79f01c, p=0x55c6b1508b40)
    at /tmp/snort/snort/src/stream/tcp/tcp_reassembler.cc:1004
Backtrace stopped: Cannot access memory at address 0x7f061d79f008
~~~

**Comment by luxifer** [comment]
I tested the offended pcap with the latest release and no segfault for me. What I did is replaying the pcap to a bridge where snort is listening, and duplicating all packet. Before the fix I had a segfault in the tcp reassembly path. Now it's working as expected.

**Comment by jaliimra** [comment]
Thanks @nagmtuc. From the backtrace, this does not appear to be the infinite recursion crash seen by others. We will investigate what we can from the trace and get back to you with any questions.

**Comment by vdechenaux** [comment]
It looks like this one https://github.com/snort3/snort3/commit/ee58a55a989c15dddb218dbb7e30ef989a27e4dc fixed our case with @luxifer

**Comment by InverseRE** [comment]
@nagmtuc 
The issue was opened against 3.1.31.0. A lot of bugs have been fixed since then.
Do you still see crashes?
May we close the case?

**Comment by nagmtuc** [comment]
Unfortunately, we did not continue testing as we are full with other things to do and debugging took a lot of time. Nevertheless, I will give it a try soon and give a reply.

**Comment by nagmtuc** [comment]
Finally we found some time here. Today we set up one of our system with the most recent versions:

- Debian 12 Bookworm
- Snort version: 3.3.2.0
- Lib DAQ version: 3.0.16

Snort is running for 1 hour now. I will give another feedback after the weekend.

**Comment by nagmtuc** [comment]
The updated System is running since Friday without any crash. Also the the memory consumption stays on a low level. On our other systems you can watch the memory usage increase until the service crashes. So it looks like the problem may be solved. Nevertheless, I will update our three other systems to check, if we can get a stable system there, too.

```
$ systemctl status snort3.service 
● snort3.service - Snort3 NIDS Daemon
     Loaded: loaded (/etc/systemd/system/snort3.service; enabled; preset: enabled)
     Active: active (running) since Fri 2024-08-09 12:05:43 CEST; 2 days ago
   Main PID: 9872 (snort3)
      Tasks: 2 (limit: 76607)
     Memory: 2.4G
        CPU: 1d 17h 2min 33.665s
     CGroup: /system.slice/snort3.service
             └─9872 /usr/local/snort/bin/snort [...]
```

**Comment by nagmtuc** [comment]
Bad news. After updating the other systems we still see crashes within seconds. Here is the backtrace:

```
root@marple:/var/lib/systemd/coredump# gdb /usr/local/snort/bin/snort core.snort3.1001.069b3622822e4a28b94e73e8930d6a53.173148.1723729409000000
GNU gdb (Debian 13.1-3) 13.1
Copyright (C) 2023 Free Software Foundation, Inc.
License GPLv3+: GNU GPL version 3 or later <http://gnu.org/licenses/gpl.html>
This is free software: you are free to change and redistribute it.
There is NO WARRANTY, to the extent permitted by law.
Type "show copying" and "show warranty" for details.
This GDB was configured as "x86_64-linux-gnu".
Type "show configuration" for configuration details.
For bug reporting instructions, please see:
<https://www.gnu.org/software/gdb/bugs/>.
Find the GDB manual and other documentation resources online at:
    <http://www.gnu.org/software/gdb/documentation/>.

For help, type "help".
Type "apropos word" to search for commands related to "word"...
Reading symbols from /usr/local/snort/bin/snort...

warning: Can't open file socket:[569810] which was expanded to socket:[569810] during file-backed mapping note processing
[New LWP 173149]
[New LWP 173148]
[Thread debugging using libthread_db enabled]
Using host libthread_db library "/lib/x86_64-linux-gnu/libthread_db.so.1".
Core was generated by `/usr/local/snort/bin/snort -v -M -c /usr/local/snort/etc/snort/snort.lua -z 1 -'.
Program terminated with signal SIGSEGV, Segmentation fault.
#0  0x00005645771488e3 in TcpReassemblerIds::scan_data_post_ack (this=this@entry=0x56458668b950, 
    flags=flags@entry=0x7f731920005c, p=p@entry=0x564583ff8a00) at /tmp/snort/snort/src/stream/tcp/tcp_reassembler_ids.cc:152
152	/tmp/snort/snort/src/stream/tcp/tcp_reassembler_ids.cc: Datei oder Verzeichnis nicht gefunden.
[Current thread is 1 (Thread 0x7f73199ff6c0 (LWP 173149))]
(gdb) bt
#0  0x00005645771488e3 in TcpReassemblerIds::scan_data_post_ack (this=this@entry=0x56458668b950, flags=flags@entry=0x7f731920005c, p=p@entry=0x564583ff8a00) at /tmp/snort/snort/src/stream/tcp/tcp_reassembler_ids.cc:152
#1  0x0000564577148a78 in TcpReassemblerIds::eval_flush_policy_on_ack (this=0x56458668b950, p=0x564583ff8a00) at /tmp/snort/snort/src/stream/tcp/tcp_reassembler_ids.cc:194
#2  0x0000564577148b1d in TcpReassemblerIds::eval_flush_policy_on_ack (this=0x56458668b950, p=0x564583ff8a00) at /tmp/snort/snort/src/stream/tcp/tcp_reassembler_ids.cc:216
#3  0x0000564577148b1d in TcpReassemblerIds::eval_flush_policy_on_ack (this=0x56458668b950, p=0x564583ff8a00) at /tmp/snort/snort/src/stream/tcp/tcp_reassembler_ids.cc:216
#4  0x0000564577148b1d in TcpReassemblerIds::eval_flush_policy_on_ack (this=0x56458668b950, p=0x564583ff8a00) at /tmp/snort/snort/src/stream/tcp/tcp_reassembler_ids.cc:216
#5  0x0000564577148b1d in TcpReassemblerIds::eval_flush_policy_on_ack (this=0x56458668b950, p=0x564583ff8a00) at /tmp/snort/snort/src/stream/tcp/tcp_reassembler_ids.cc:216
#6  0x0000564577148b1d in TcpReassemblerIds::eval_flush_policy_on_ack (this=0x56458668b950, p=0x564583ff8a00) at /tmp/snort/snort/src/stream/tcp/tcp_reassembler_ids.cc:216
#7  0x0000564577148b1d in TcpReassemblerIds::eval_flush_policy_on_ack (this=0x56458668b950, p=0x564583ff8a00) at /tmp/snort/snort/src/stream/tcp/tcp_reassembler_ids.cc:216
#8  0x0000564577148b1d in TcpReassemblerIds::eval_flush_policy_on_ack (this=0x56458668b950, p=0x564583ff8a00) at /tmp/snort/snort/src/stream/tcp/tcp_reassembler_ids.cc:216
#9  0x0000564577148b1d in TcpReassemblerIds::eval_flush_policy_on_ack (this=0x56458668b950, p=0x564583ff8a00) at /tmp/snort/snort/src/stream/tcp/tcp_reassembler_ids.cc:216
#10 0x0000564577148b1d in TcpReassemblerIds::eval_flush_policy_on_ack (this=0x56458668b950, p=0x564583ff8a00) at /tmp/snort/snort/src/stream/tcp/tcp_reassembler_ids.cc:216

[...]

#128410 0x0000564577148b1d in TcpReassemblerIds::eval_flush_policy_on_ack (this=0x56458668b950, p=0x564583ff8a00) at /tmp/snort/snort/src/stream/tcp/tcp_reassembler_ids.cc:216
#128411 0x0000564577148b1d in TcpReassemblerIds::eval_flush_policy_on_ack (this=0x56458668b950, p=0x564583ff8a00) at /tmp/snort/snort/src/stream/tcp/tcp_reassembler_ids.cc:216
#128412 0x0000564577148b1d in TcpReassemblerIds::eval_flush_policy_on_ack (this=0x56458668b950, p=0x564583ff8a00) at /tmp/snort/snort/src/stream/tcp/tcp_reassembler_ids.cc:216
#128413 0x0000564577148b1d in TcpReassemblerIds::eval_flush_policy_on_ack (this=0x56458668b950, p=0x564583ff8a00) at /tmp/snort/snort/src/stream/tcp/tcp_reassembler_ids.cc:216
#128414 0x0000564577148b1d in TcpReassemblerIds::eval_flush_policy_on_ack (this=0x56458668b950, p=0x564583ff8a00) at /tmp/snort/snort/src/stream/tcp/tcp_reassembler_ids.cc:216
#128415 0x0000564577148b1d in TcpReassemblerIds::eval_flush_policy_on_ack (this=0x56458668b950, p=0x564583ff8a00) at /tmp/snort/snort/src/stream/tcp/tcp_reassembler_ids.cc:216
#128416 0x0000564577148b1d in TcpReassemblerIds::eval_flush_policy_on_ack (this=0x56458668b950, p=0x564583ff8a00) at /tmp/snort/snort/src/stream/tcp/tcp_reassembler_ids.cc:216
#128417 0x0000564577148b1d in TcpReassemblerIds::eval_flush_policy_on_ack (this=0x56458668b950, p=0x564583ff8a00) at /tmp/snort/snort/src/stream/tcp/tcp_reassembler_ids.cc:216
#128418 0x0000564577148b1d in TcpReassemblerIds::eval_flush_policy_on_ack (this=0x56458668b950, p=0x564583ff8a00) at /tmp/snort/snort/src/stream/tcp/tcp_reassembler_ids.cc:216
#128419 0x000056457714f58c in TcpStateEstablished::ack_sent (this=<optimized out>, tsd=..., trk=...) at /tmp/snort/snort/src/stream/tcp/tcp_state_established.cc:76
#128420 0x0000564577150cb9 in TcpStateMachine::eval (this=0x564578f82680, tsd=...) at /tmp/snort/snort/src/stream/tcp/tcp_state_machine.cc:102
#128421 0x000056457714e179 in TcpSession::process_tcp_packet (p=0x564583ff8a00, tsd=..., this=0x56457e4be380) at /tmp/snort/snort/src/stream/tcp/tcp_session.cc:1027
#128422 TcpSession::process (this=0x56457e4be380, p=0x564583ff8a00) at /tmp/snort/snort/src/stream/tcp/tcp_session.cc:1067
#128423 0x00005645770d2f9b in snort::InspectorManager::internal_execute<false> (p=p@entry=0x564583ff8a00) at /tmp/snort/snort/src/managers/inspector_manager.cc:2038
#128424 0x00005645770d0a98 in snort::InspectorManager::execute (p=p@entry=0x564583ff8a00) at /tmp/snort/snort/src/managers/inspector_manager.cc:2080
#128425 0x0000564576ffae16 in snort::DetectionEngine::inspect (p=0x564583ff8a00) at /tmp/snort/snort/src/detection/detection_engine.cc:644
#128426 0x00005645770a3475 in Analyzer::process_daq_pkt_msg (this=this@entry=0x564581f0ef00, msg=msg@entry=0x564582fb6f08, retry=retry@entry=false) at /tmp/snort/snort/src/main/analyzer.cc:435
#128427 0x00005645770a367f in Analyzer::process_daq_msg (this=this@entry=0x564581f0ef00, msg=0x564582fb6f08, retry=retry@entry=false) at /tmp/snort/snort/src/main/analyzer.cc:460
#128428 0x00005645770a49da in Analyzer::process_messages (this=this@entry=0x564581f0ef00) at /tmp/snort/snort/src/main/analyzer.cc:901
#128429 0x00005645770a4c2b in Analyzer::analyze (this=this@entry=0x564581f0ef00) at /tmp/snort/snort/src/main/analyzer.cc:933
#128430 0x00005645770a4db3 in Analyzer::operator() (this=0x564581f0ef00, ps=0x564584119930, run_num=<optimized out>) at /tmp/snort/snort/src/main/analyzer.cc:774
#128431 0x00007f731d4d44a3 in ?? () from /lib/x86_64-linux-gnu/libstdc++.so.6
#128432 0x00007f731d6a9134 in start_thread (arg=<optimized out>) at ./nptl/pthread_create.c:442
#128433 0x00007f731d7297dc in clone3 () at ../sysdeps/unix/sysv/linux/x86_64/clone3.S:81
(gdb)
```

**Comment by redbaron4** [comment]
Hi, I too seem to have stumbled on "blown stack" problem. This occurs with Snort-3.6.1.0 and is much more frequent on our intranet segment.

```
(gdb) bt
#0  0x0000555555870d49 in TcpReassemblerIds::scan_data_post_ack(unsigned int*, snort::Packet*) ()
#1  0x00005555558710c0 in TcpReassemblerIds::eval_flush_policy_on_ack(snort::Packet*) ()
#2  0x00005555558711ae in TcpReassemblerIds::eval_flush_policy_on_ack(snort::Packet*) ()
#3  0x00005555558711ae in TcpReassemblerIds::eval_flush_policy_on_ack(snort::Packet*) ()
#4  0x00005555558711ae in TcpReassemblerIds::eval_flush_policy_on_ack(snort::Packet*) ()
#5  0x00005555558711ae in TcpReassemblerIds::eval_flush_policy_on_ack(snort::Packet*) ()
#6  0x00005555558711ae in TcpReassemblerIds::eval_flush_policy_on_ack(snort::Packet*) ()
#7  0x00005555558711ae in TcpReassemblerIds::eval_flush_policy_on_ack(snort::Packet*) ()

(gdb) bt -1
#128429 0x00007ffff4682e73 in clone () from /lib64/libc.so.6
```

It happens on running traffic and also while reading directly from PCAP and occurs randomly. Earlier I had opened the linked issue which I have now closed as duplicate of this one. It has some more information about our config and compile time options.

Unfortunately, I can't share PCAP or code dump due to our organization policy but if there is some wway I can assist in debugging, please let me know

**Comment by ssam18** [comment]
Looks like this is fixed in current snort3 by PR #4741 (commit e35219f, merged 2025-08-08) "stream_tcp: fix issues with skipping seglist holes in ids mode". It rewrites `eval_flush_policy_on_ack` to handle the SKIP case iteratively inside the do-while loop instead of via the recursive `return eval_flush_policy_on_ack(p)` call that produced the deep stacks in every backtrace here.

First fixed release: **3.9.3.0** (2025-08-11). Current latest is 3.12.2.0. @nagmtuc @redbaron4 could you retest on a current build?

**Comment by redbaron4** [comment]
Hi @ssam18 we haven't run into this issue in a long time. Our Snort builds are updated regularly so we have been running the fixed builds since Aug 2025.

**Comment by nagmtuc** [comment]
I am very sorry for the late reply. I thought I already did this :/ The issue seems to be fixed. Since about 7 months we are running snort without issues:

~~~
   ,,_     -*> Snort++ <*-
  o"  )~   Version 3.9.7.0
   ''''    By Martin Roesch & The Snort Team
           http://snort.org/contact#team
           Copyright (C) 2014-2025 Cisco and/or its affiliates. All rights reserved.
           Copyright (C) 1998-2013 Sourcefire, Inc., et al.
           Using DAQ version 3.0.22
           Using Hyperscan version 5.4.12 2025-11-13
           Using libpcap version 1.10.5 (with TPACKET_V3)
           Using LuaJIT version 2.1.1737090214
           Using LZMA version 5.8.1
           Using OpenSSL 3.5.1 1 Jul 2025
           Using PCRE2 version 10.46 2025-08-27
           Using ZLIB version 1.3.1
~~~
