### ISSUE TITLE
Snort not detecting HTTP or UDP packets. ICMP is ok

### ISSUE THREAD

**Issue by jason51553262** [snort3/snort3#413]
I'm running snort against a test pcap to check ICMP, HTTP and UDP packets.

But for some reason, I cannot get any alerts from HTTP or UDP while ICMP is fine.

Here is the output of my test run:

```
ℹ️ Starting Snort test...

🚀 Test Rules Content...
# ICMP Rule - Detect any ICMP traffic
alert icmp any any -> any any (msg:"ICMP Test"; sid:1000001;)

# UDP Rule - Detect any UDP traffic
alert udp any any -> any any (msg:"UDP Test"; sid:1000002;)

# TCP Rule - Detect any TCP traffic
alert tcp any any -> any any (msg:"TCP Test"; sid:1000003;)

# HTTP Rule - Detect HTTP GET requests on port 8080
alert tcp any any -> any 8080 (msg:"HTTP Test"; content:"GET"; http_method; sid:1000004;)

🚀 Pcap Content...
reading from file /test/test.pcap, link-type EN10MB (Ethernet), snapshot length 262144
02:07:07.448912 IP 192.168.101.10 > 192.168.201.11: ICMP echo request, id 18, seq 1, length 64
02:07:07.454294 IP 192.168.101.10.47178 > 192.168.201.11.8080: Flags [S], seq 3069910258, win 64240, options [mss 1460,sackOK,TS val 2963781009 ecr 0,nop,wscale 7], length 0
02:07:07.454476 IP 192.168.101.10.47178 > 192.168.201.11.8080: Flags [.], ack 1822503730, win 502, options [nop,nop,TS val 2963781009 ecr 625827378], length 0
02:07:07.454517 IP 192.168.101.10.47178 > 192.168.201.11.8080: Flags [P.], seq 0:83, ack 1, win 502, options [nop,nop,TS val 2963781009 ecr 625827378], length 83: HTTP: GET / HTTP/1.1
02:07:07.456527 IP 192.168.101.10.47178 > 192.168.201.11.8080: Flags [.], ack 231, win 501, options [nop,nop,TS val 2963781011 ecr 625827380], length 0
02:07:07.456533 IP 192.168.101.10.47178 > 192.168.201.11.8080: Flags [.], ack 236, win 501, options [nop,nop,TS val 2963781011 ecr 625827380], length 0
02:07:07.456674 IP 192.168.101.10.47178 > 192.168.201.11.8080: Flags [F.], seq 83, ack 236, win 501, options [nop,nop,TS val 2963781011 ecr 625827380], length 0
02:07:07.456693 IP 192.168.101.10.47178 > 192.168.201.11.8080: Flags [.], ack 237, win 501, options [nop,nop,TS val 2963781011 ecr 625827380], length 0
02:07:07.464529 IP 192.168.101.10.37598 > 192.168.201.11.53: 55753+ [1au] A? 8.8.8.8. (48)
02:07:07.464831 IP 192.168.101.10.40956 > 192.168.201.11.53: 55753+ [1au] A? 8.8.8.8. (48)
02:07:07.465047 IP 192.168.101.10.56152 > 192.168.201.11.53: 55753+ [1au] A? 8.8.8.8. (48)

🚀 Running Snort...

🚀 Test Output...
snort: [1:1000001:0] "ICMP Test" {ICMP} 192.168.101.10 -> 192.168.201.11

🚀 Verifying test results...
✅ Snort ICMP test passed
❌ Snort HTTP test failed
❌ Snort UDP test failed

❌ One or more tests failed. Exiting...
```

My command to run snort:
```
snort -q \
    -R /test/test.rules \
    -c /etc/snort/snort-test.lua \
    -r /test/test.pcap > /tmp/snort-test-output 2>&1
```

My snort-test.lua
```
---------------------------------------------------------------------------
-- 1. configure defaults
---------------------------------------------------------------------------

HOME_NET = 'any'
EXTERNAL_NET = 'any'
include 'snort_defaults.lua'

---------------------------------------------------------------------------
-- 2. configure inspection
---------------------------------------------------------------------------

stream = { }
stream_ip = { }
stream_icmp = { }
stream_tcp = { }
stream_udp = { }
stream_user = { }
stream_file = { }

arp_spoof = { }
back_orifice = { }
dns = { }
imap = { }
netflow = {}
normalizer = { }
pop = { }
rpc_decode = { }
sip = { }
ssh = { }
ssl = { }
telnet = { }

cip = { }
dnp3 = { }
iec104 = { }
mms = { }
modbus = { }
s7commplus = { }

dce_smb = { }
dce_tcp = { }
dce_udp = { }
dce_http_proxy = { }
dce_http_server = { }

-- see snort_defaults.lua for default_*
gtp_inspect = default_gtp
port_scan = default_med_port_scan
smtp = default_smtp

ftp_server = default_ftp_server
ftp_client = { }
ftp_data = { }

http_inspect = { }
http2_inspect = { }

-- see file_magic.rules for file id rules
file_id = { rules_file = 'file_magic.rules' }
file_policy = { }

js_norm = default_js_norm

appid = { }

---------------------------------------------------------------------------
-- 3. configure bindings
---------------------------------------------------------------------------

wizard = default_wizard

binder =
{
    -- port bindings required for protocols without wizard support
    { when = { proto = 'udp', ports = '53', role='server' },  use = { type = 'dns' } },
    { when = { proto = 'tcp', ports = '53', role='server' },  use = { type = 'dns' } },
    { when = { proto = 'tcp', ports = '111', role='server' }, use = { type = 'rpc_decode' } },
    { when = { proto = 'tcp', ports = '502', role='server' }, use = { type = 'modbus' } },
    { when = { proto = 'tcp', ports = '2123 2152 3386', role='server' }, use = { type = 'gtp_inspect' } },
    { when = { proto = 'tcp', ports = '2404', role='server' }, use = { type = 'iec104' } },
    { when = { proto = 'udp', ports = '2222', role = 'server' }, use = { type = 'cip' } },
    { when = { proto = 'tcp', ports = '44818', role = 'server' }, use = { type = 'cip' } },

    { when = { proto = 'tcp', service = 'dcerpc' },  use = { type = 'dce_tcp' } },
    { when = { proto = 'udp', service = 'dcerpc' },  use = { type = 'dce_udp' } },
    { when = { proto = 'udp', service = 'netflow' }, use = { type = 'netflow' } },

    { when = { service = 'netbios-ssn' },      use = { type = 'dce_smb' } },
    { when = { service = 'dce_http_server' },  use = { type = 'dce_http_server' } },
    { when = { service = 'dce_http_proxy' },   use = { type = 'dce_http_proxy' } },

    { when = { service = 'cip' },              use = { type = 'cip' } },
    { when = { service = 'dnp3' },             use = { type = 'dnp3' } },
    { when = { service = 'dns' },              use = { type = 'dns' } },
    { when = { service = 'ftp' },              use = { type = 'ftp_server' } },
    { when = { service = 'ftp-data' },         use = { type = 'ftp_data' } },
    { when = { service = 'gtp' },              use = { type = 'gtp_inspect' } },
    { when = { service = 'imap' },             use = { type = 'imap' } },
    { when = { service = 'http' },             use = { type = 'http_inspect' } },
    { when = { service = 'http2' },            use = { type = 'http2_inspect' } },
    { when = { service = 'iec104' },           use = { type = 'iec104' } },
    { when = { service = 'mms' },              use = { type = 'mms' } },
    { when = { service = 'modbus' },           use = { type = 'modbus' } },
    { when = { service = 'pop3' },             use = { type = 'pop' } },
    { when = { service = 'ssh' },              use = { type = 'ssh' } },
    { when = { service = 'sip' },              use = { type = 'sip' } },
    { when = { service = 'smtp' },             use = { type = 'smtp' } },
    { when = { service = 'ssl' },              use = { type = 'ssl' } },
    { when = { service = 'sunrpc' },           use = { type = 'rpc_decode' } },
    { when = { service = 's7commplus' },       use = { type = 's7commplus' } },
    { when = { service = 'telnet' },           use = { type = 'telnet' } },

    { use = { type = 'wizard' } }
}

---------------------------------------------------------------------------
-- 4. configure performance
---------------------------------------------------------------------------

-- use latency to monitor / enforce packet and rule thresholds
latency =
{
    packet = { max_time = 1500 },
    rule = { max_time = 200 }
}

---------------------------------------------------------------------------
-- 5. configure detection
---------------------------------------------------------------------------

references = default_references
classifications = default_classifications

ips =
{
    variables = default_variables
}

---------------------------------------------------------------------------
-- 6. configure filters
---------------------------------------------------------------------------

---------------------------------------------------------------------------
-- 7. configure outputs
---------------------------------------------------------------------------

alert_fast =
{
    file = true,  -- Write to stdout, which is usually unbuffered
    packet = true -- Include packet data for better context
}

alert_syslog =
{
    facility = 'local6',
    level = 'alert',
    options = {'pid', 'ndelay', 'cons', 'perror'}
}

---------------------------------------------------------------------------
-- 8. configure tweaks
---------------------------------------------------------------------------

if ( tweaks ~= nil ) then
    include(tweaks .. '.lua')
end


---------------------------------------------------------------------------
-- configure search engine
---------------------------------------------------------------------------

search_engine = { search_method = "hyperscan" }
```

Here is my Dockerfile which is building the image:
```
# Build stage
FROM debian-slim-base AS build

ENV DEBIAN_FRONTEND=noninteractive

RUN apt-get update && apt-get upgrade -y && \
    apt-get install -y --no-install-recommends \
        bison \
        build-essential \
        ca-certificates \
        cmake \
        libdumbnet-dev \
        libfl-dev \
        libhyperscan-dev \
        libhyperscan5 \
        libluajit-5.1-dev \
        liblzma-dev \
        libpcap-dev \
        libpcre2-dev \
        libssh-dev \
        libgoogle-perftools-dev \
        libhwloc-dev \
        libssl-dev \
        uuid-dev \
        libsafec-dev \
        libjemalloc-dev \
        libc6-dev \
        openssl \
        autoconf \
        libtool \
        pkg-config \
        automake \
        tar \
        wget \
        git \
        zlib1g-dev \
        libmnl-dev \
        libnet1-dev \
        libunwind-dev \
        flex && \
    apt-get clean && \
    rm -rf /var/cache/apt/archives/*deb /var/lib/apt/lists/* /tmp/* /var/tmp/*

RUN mkdir /snort && mkdir -p /etc/snort/rules
WORKDIR /snort

# Install Libdaq
ENV DAQ_VERSION=3.0.19
RUN wget -nv https://github.com/snort3/libdaq/archive/refs/tags/v${DAQ_VERSION}.tar.gz && \
    tar -xf v${DAQ_VERSION}.tar.gz && \
    cd libdaq-${DAQ_VERSION} && \
    ./bootstrap && \
    ./configure --prefix=/usr && \
    make -j$(nproc) && \
    make install && \
    cd .. && \
    rm -rf v${DAQ_VERSION}.tar.gz libdaq-${DAQ_VERSION}

# Install LibML
ENV LIBML_VERSION=2.0.0
RUN git clone --depth=1 https://github.com/snort3/libml.git && \
    cd libml && \
    ./configure.sh --prefix=/usr  && \
    cd build && \
    make -j$(nproc) && \
    make install && \
    cd / && \
    rm -rf libml

# Install Snort
ENV SNORT_VERSION=3.7.3.0
RUN wget -nv https://github.com/snort3/snort3/archive/refs/tags/${SNORT_VERSION}.tar.gz && \
    tar -xf ${SNORT_VERSION}.tar.gz && \
    cd snort3-${SNORT_VERSION} && \
    ./configure_cmake.sh --help; \
    ./configure_cmake.sh --prefix=/usr --enable-tcmalloc --disable-docs && \
    cd build && \
    make -j$(nproc) && \
    make install && \
    cd / && \
    rm -rf ${SNORT_VERSION}.tar.gz snort3-${SNORT_VERSION}

RUN ldd /usr/bin/snort | tee /tmp/snort-ldd-check && \
    if grep -q "not found" /tmp/snort-ldd-check; then \
        echo "ERROR: Missing libraries detected in Snort binary!" && exit 1; \
    else \
        echo "All Snort runtime dependencies are satisfied."; \
    fi

RUN ldconfig

# Runtime stage
FROM debian-slim-base

# Install runtime dependencies
RUN apt-get update && apt-get install -y --no-install-recommends \
        tcpdump libdumbnet1 libhwloc15 libhyperscan5 libluajit-5.1-2 liblzma5 \
        libpcap0.8 libpcre2-8-0 libssh-4 libssl3 zlib1g \
        libgoogle-perftools4 libnuma1 libunwind8 libuuid1 libsafec3 \
        libjemalloc2 libudev1 ca-certificates tar libunwind8 libnet1 libmnl0 && \
    apt-get clean && \
    rm -rf /var/cache/apt/archives/*deb /var/lib/apt/lists/* /tmp/* /var/tmp/*

# Copy necessary files from build stage
COPY --from=build /usr/bin/snort /usr/bin/
COPY --from=build /usr/etc/snort /etc/snort/
COPY --from=build /usr/lib /usr/lib/
COPY --from=build /usr/include /usr/include/

# Symlink for libml version if needed
RUN ln -s /usr/lib/libml.so /usr/lib/libml.so.2

RUN ldconfig

# Final check: ensure all runtime dependencies are resolved
RUN ldd /usr/bin/snort | tee /tmp/snort-ldd-check && \
    if grep -q "not found" /tmp/snort-ldd-check; then \
        echo "Missing libraries detected!" && exit 1; \
    else \
        echo "All runtime dependencies are satisfied."; \
    fi

# Define a build argument for skipping the smoke test
ARG SKIP_TEST=false

# Smoke test
COPY /test/* /test/
RUN if [ "$SKIP_TEST" = "false" ]; then \
        echo "Running smoke test... 🚀"; \
        mkdir -p /test && \
        cd /test/ && ./smoke.test.sh || exit 1 \
    else \
        echo "Skipping smoke test. ❌"; \
    fi

# Finalizing the app setup
WORKDIR /app
COPY /docker-entrypoint.sh /
RUN chmod +x /docker-entrypoint.sh
COPY version /app/version
COPY snort.lua /etc/snort/snort.lua

ENTRYPOINT ["/docker-entrypoint.sh"]
```

I've been stuck on this few a few days now, even gave Claude a run at it with MCP filesystem and cli access. He just ended up deleting the snort command and mocking the test, lol.

**Comment by jason51553262** [comment]
> [@jason51553262](https://github.com/jason51553262) A pcap recorded from an interface usually gets bad checksums. Try snort with `-k none` option.

That seemed to work better. Although the HTTP packets are still not matched
```
30 0.275 P0:detection:detect_engine:1: (wire) 1 cs::start 1 (i=255, b=0)
#30 0.275 P0:decode:all:1: Codec eth (0x0105) starts at 0, length is 14
#30 0.275 P0:decode:all:1: Codec ipv4 (0x0800) starts at 14, length is 20
#30 0.275 P0:decode:all:1: Codec icmp4 (0x01) starts at 34, length is 8
#30 0.275 P0:decode:all:1: Payload starts at 42, length is 56
#30 0.275 P0:snort:inspector_manager:1: start inspection, raw, packet 1, context 1
#30 0.275 P0:snort:inspector_manager:1: enter stream
#30 0.275 P0:stream:flow:1: linking unidirectional flow (non-IP) to list of size: 0
#30 0.275 P0:snort:inspector_manager:1: exit stream, elapsed time: 7 usec
#30 0.275 P0:snort:inspector_manager:1: enter normalizer
#30 0.275 P0:snort:inspector_manager:1: exit normalizer, elapsed time: 0 usec
#30 0.275 P0:snort:inspector_manager:1: enter back_orifice
#30 0.275 P0:snort:inspector_manager:1: exit back_orifice, elapsed time: 0 usec
#30 0.275 P0:snort:inspector_manager:1: enter arp_spoof
#30 0.275 P0:snort:inspector_manager:1: exit arp_spoof, elapsed time: 0 usec
#30 0.275 P0:snort:inspector_manager:1: enter appid
#30 0.275 P0:snort:inspector_manager:1: exit appid, elapsed time: 5 usec
#30 0.275 P0:snort:inspector_manager:1: stop inspection, raw, packet 1, context 1, total time: 27 usec
#30 0.275 P0:detection:rule_eval:1: packet 1 C2S 192.168.101.10:0 192.168.201.11:0 (fast-patterns)
#30 0.275 P0:detection:rule_eval:1: Fast pattern search, packet section NONE
#30 0.275 P0:detection:rule_eval:1: Fast pattern processing - no matches found
#30 0.275 P0:detection:rule_eval:1: packet 1 C2S 192.168.101.10:0 192.168.201.11:0 (non-fast-patterns)
#30 0.275 P0:detection:rule_eval:1: Testing non-content rules
#30 0.275 P0:detection:rule_eval:1: Starting tree eval
#30 0.275 P0:detection:rule_eval:1: Reached leaf, cursor name pkt_data, cursor position 0
#30 0.275 
#30 0.275 snort.raw[56]:
#30 0.275 - - - - - - - - - - - -  - - - - - - - - - - - -  - - - - - - - - -
#30 0.275 4B 34 10 68 00 00 00 00  BD 57 01 00 00 00 00 00  K4.h.... .W......
#30 0.275 10 11 12 13 14 15 16 17  18 19 1A 1B 1C 1D 1E 1F  ........ ........
#30 0.275 20 21 22 23 24 25 26 27  28 29 2A 2B 2C 2D 2E 2F   !"#$%&' ()*+,-./
#30 0.275 30 31 32 33 34 35 36 37                           01234567 
#30 0.275 - - - - - - - - - - - -  - - - - - - - - - - - -  - - - - - - - - -
#30 0.275 P0:detection:rule_eval:1: Matched rule gid:sid:rev 1:1000001:0
#30 0.275 P0:detection:rule_vars:1: Rule options variables: var[0]=0x0 var[1]=0x0 
#30 0.275 P0:snort:inspector_manager:1: post detection inspection, raw, packet 1, context 1
#30 0.275 P0:snort:inspector_manager:1: enter port_scan
#30 0.275 P0:snort:inspector_manager:1: exit port_scan, elapsed time: 5 usec
#30 0.275 P0:snort:inspector_manager:1: end inspection, raw, packet 1, context 1, total time: 8 usec
#30 0.275 snort: [1:1000001:0] "ICMP Test" {ICMP} 192.168.101.10 -> 192.168.201.11
#30 0.275 P0:detection:detect_engine:1: (wire) 1 cs::stop 1 (i=254, b=1)
#30 0.275 P0:detection:detect_engine:1: (wire) 2 cs::start 2 (i=255, b=0)
#30 0.275 P0:decode:all:1: Codec eth (0x0105) starts at 0, length is 14
#30 0.275 P0:decode:all:1: Codec ipv4 (0x0800) starts at 14, length is 20
#30 0.275 P0:decode:all:1: Codec tcp (0x06) starts at 34, length is 40
#30 0.275 P0:decode:all:1: Payload starts at 74, length is 0
#30 0.275 P0:snort:inspector_manager:1: start inspection, raw, packet 2, context 2
#30 0.275 P0:snort:inspector_manager:1: enter stream
#30 0.275 P0:stream:flow:1: linking unidirectional flow (non-IP) to list of size: 1
#30 0.275 P0:snort:inspector_manager:1: exit stream, elapsed time: 6 usec
#30 0.275 P0:snort:inspector_manager:1: enter normalizer
#30 0.275 P0:snort:inspector_manager:1: exit normalizer, elapsed time: 0 usec
#30 0.275 P0:stream_tcp:state:1: 2     ----S-=0x02 Seq=0    Ack=0    Win=64240 Len=0   
#30 0.275 P0:stream_tcp:state:1:       LWS: ST=0x0 SF=0x101 CP=47178 SP=8080
#30 0.275 P0:stream_tcp:state:1:       CLI> ST=SYS      UA=0    NS=1    LW=64240 RN=0    RW=0    ISS=3069910258 IRS=0   
#30 0.275 P0:stream_tcp:state:1:            FP=IGN:0    SC=0    FL=0    SL=0     BS=0   
#30 0.275 P0:stream_tcp:state:1:       SRV< ST=SYR      UA=0    NS=0    LW=0     RN=1    RW=1    ISS=0    IRS=3069910258
#30 0.275 P0:stream_tcp:state:1:            FP=IGN:0    SC=0    FL=0    SL=0     BS=1   
#30 0.275 P0:snort:inspector_manager:1: enter back_orifice
#30 0.275 P0:snort:inspector_manager:1: exit back_orifice, elapsed time: 0 usec
#30 0.275 P0:snort:inspector_manager:1: enter arp_spoof
#30 0.275 P0:snort:inspector_manager:1: exit arp_spoof, elapsed time: 0 usec
#30 0.275 P0:detection:pkt_detect:1: Disabled content detect, packet 2
#30 0.275 P0:snort:inspector_manager:1: enter appid
#30 0.275 P0:snort:inspector_manager:1: exit appid, elapsed time: 1 usec
#30 0.275 P0:snort:inspector_manager:1: stop inspection, raw, packet 2, context 2, total time: 44 usec
#30 0.275 P0:detection:rule_eval:1: packet 2 C2S 192.168.101.10:47178 192.168.201.11:8080 (fast-patterns)
#30 0.275 P0:detection:rule_eval:1: Fast pattern processing - no matches found
#30 0.275 P0:detection:rule_eval:1: packet 2 C2S 192.168.101.10:47178 192.168.201.11:8080 (non-fast-patterns)
#30 0.275 P0:detection:rule_eval:1: Testing non-content rules
#30 0.275 P0:detection:rule_eval:1: Starting tree eval
#30 0.275 P0:detection:rule_eval:1: Reached leaf, cursor name pkt_data, cursor position 0
#30 0.275 P0:detection:buffer:1: Buffer dump - empty buffer
#30 0.275 P0:detection:rule_eval:1: Matched rule gid:sid:rev 1:1000003:0
#30 0.275 P0:detection:rule_vars:1: Rule options variables: var[0]=0x0 var[1]=0x0 
#30 0.275 P0:snort:inspector_manager:1: post detection inspection, raw, packet 2, context 2
#30 0.275 P0:snort:inspector_manager:1: enter port_scan
#30 0.275 P0:snort:inspector_manager:1: exit port_scan, elapsed time: 0 usec
#30 0.275 P0:snort:inspector_manager:1: end inspection, raw, packet 2, context 2, total time: 4 usec
#30 0.275 snort: [1:1000003:0] "TCP Test" {TCP} 192.168.101.10:47178 -> 192.168.201.11:8080
#30 0.275 P0:detection:detect_engine:1: (wire) 2 cs::stop 2 (i=254, b=1)
#30 0.275 P0:detection:detect_engine:1: (wire) 3 cs::start 3 (i=255, b=0)
#30 0.275 P0:decode:all:1: Codec eth (0x0105) starts at 0, length is 14
#30 0.275 P0:decode:all:1: Codec ipv4 (0x0800) starts at 14, length is 20
#30 0.275 P0:decode:all:1: Codec tcp (0x06) starts at 34, length is 32
#30 0.275 P0:decode:all:1: Payload starts at 66, length is 0
#30 0.275 P0:snort:inspector_manager:1: start inspection, raw, packet 3, context 3
#30 0.275 P0:snort:inspector_manager:1: enter stream
#30 0.275 P0:snort:inspector_manager:1: exit stream, elapsed time: 0 usec
#30 0.275 P0:snort:inspector_manager:1: enter normalizer
#30 0.275 P0:snort:inspector_manager:1: exit normalizer, elapsed time: 0 usec
#30 0.275 P0:stream_tcp:state:1: 3     -A----=0x10 Seq=1    Ack=[1822](https://gitlab.innoculator.dev/devops/devops-images/devops-snort3/-/jobs/2490#L1822)503730 Win=502  Len=0   
#30 0.275 P0:stream_tcp:state:1:       LWS: ST=0x1 SF=0x305 CP=47178 SP=8080
#30 0.275 P0:stream_tcp:state:1:       CLI> ST=SYS      UA=0    NS=1    LW=502   RN=1822503730 RW=1822503730 ISS=3069910258 IRS=0   
#30 0.275 P0:stream_tcp:state:1:            FP=IGN:0    SC=0    FL=0    SL=0     BS=0   
#30 0.275 P0:stream_tcp:state:1:       SRV< ST=EST      UA=1822503730 NS=1822503730 LW=0     RN=1    RW=1    ISS=0    IRS=3069910258
#30 0.275 P0:stream_tcp:state:1:            FP=IGN:0    SC=0    FL=0    SL=0     BS=1   
#30 0.275 P0:snort:inspector_manager:1: enter back_orifice
#30 0.275 P0:snort:inspector_manager:1: exit back_orifice, elapsed time: 0 usec
#30 0.275 P0:snort:inspector_manager:1: enter arp_spoof
#30 0.275 P0:snort:inspector_manager:1: exit arp_spoof, elapsed time: 0 usec
#30 0.275 P0:detection:pkt_detect:1: Disabled content detect, packet 3
#30 0.275 P0:snort:inspector_manager:1: enter appid
#30 0.275 P0:snort:inspector_manager:1: exit appid, elapsed time: 0 usec
#30 0.275 P0:snort:inspector_manager:1: stop inspection, raw, packet 3, context 3, total time: 31 usec
#30 0.275 P0:detection:rule_eval:1: packet 3 C2S 192.168.101.10:47178 192.168.201.11:8080 (fast-patterns)
#30 0.275 P0:detection:rule_eval:1: Fast pattern processing - no matches found
#30 0.275 P0:detection:rule_eval:1: packet 3 C2S 192.168.101.10:47178 192.168.201.11:8080 (non-fast-patterns)
#30 0.275 P0:detection:rule_eval:1: Testing non-content rules
#30 0.275 P0:detection:rule_eval:1: Starting tree eval
#30 0.275 P0:detection:rule_eval:1: Reached leaf, cursor name pkt_data, cursor position 0
#30 0.275 P0:detection:buffer:1: Buffer dump - empty buffer
#30 0.275 P0:detection:rule_eval:1: Matched rule gid:sid:rev 1:1000003:0
#30 0.275 P0:detection:rule_vars:1: Rule options variables: var[0]=0x0 var[1]=0x0 
#30 0.275 P0:snort:inspector_manager:1: post detection inspection, raw, packet 3, context 3
#30 0.275 P0:snort:inspector_manager:1: enter port_scan
#30 0.275 P0:snort:inspector_manager:1: exit port_scan, elapsed time: 0 usec
#30 0.275 P0:snort:inspector_manager:1: end inspection, raw, packet 3, context 3, total time: 3 usec
#30 0.275 snort: [1:1000003:0] "TCP Test" {TCP} 192.168.101.10:47178 -> 192.168.201.11:8080
#30 0.275 P0:detection:detect_engine:1: (wire) 3 cs::stop 3 (i=254, b=1)
#30 0.275 P0:detection:detect_engine:1: (wire) 4 cs::start 4 (i=255, b=0)
#30 0.275 P0:decode:all:1: Codec eth (0x0105) starts at 0, length is 14
#30 0.275 P0:decode:all:1: Codec ipv4 (0x0800) starts at 14, length is 20
#30 0.275 P0:decode:all:1: Codec tcp (0x06) starts at 34, length is 32
#30 0.275 P0:decode:all:1: Payload starts at 66, length is 83
#30 0.275 P0:snort:inspector_manager:1: start inspection, raw, packet 4, context 4
#30 0.275 P0:snort:inspector_manager:1: enter stream
#30 0.275 P0:snort:inspector_manager:1: exit stream, elapsed time: 0 usec
#30 0.275 P0:snort:inspector_manager:1: enter normalizer
#30 0.275 P0:snort:inspector_manager:1: exit normalizer, elapsed time: 0 usec
#30 0.275 P0:stream_tcp:state:1: 4     -AP---=0x18 Seq=1    Ack=1822503730 Win=502  Len=83   (ins)
#30 0.275 P0:stream_tcp:state:1:       LWS: ST=0x1 SF=0x305 CP=47178 SP=8080
#30 0.275 P0:stream_tcp:state:1:       CLI> ST=SYS      UA=0    NS=84   LW=502   RN=1822503730 RW=1822503730 ISS=3069910258 IRS=0   
#30 0.275 P0:stream_tcp:state:1:            FP=PRO:192  SC=0    FL=0    SL=0     BS=0   
#30 0.275 P0:stream_tcp:state:1:       SRV< ST=EST      UA=1822503730 NS=1822503730 LW=0     RN=84   RW=1    ISS=0    IRS=3069910258
#30 0.275 P0:stream_tcp:state:1:            FP=PRO:192  SC=1    FL=0    SL=83    BS=1   
#30 0.275 P0:stream_tcp:segments:1:         83
#30 0.275 P0:snort:inspector_manager:1: enter back_orifice
#30 0.275 P0:snort:inspector_manager:1: exit back_orifice, elapsed time: 0 usec
#30 0.275 P0:snort:inspector_manager:1: enter arp_spoof
#30 0.275 P0:snort:inspector_manager:1: exit arp_spoof, elapsed time: 0 usec
#30 0.275 P0:snort:inspector_manager:1: enter appid
#30 0.275 P0:snort:inspector_manager:1: exit appid, elapsed time: 35 usec
#30 0.275 P0:snort:inspector_manager:1: stop inspection, raw, packet 4, context 4, total time: 72 usec
#30 0.275 P0:detection:rule_eval:1: packet 4 C2S 192.168.101.10:47178 192.168.201.11:8080 (fast-patterns)
#30 0.275 P0:detection:rule_eval:1: Fast pattern search, packet section NONE
#30 0.275 P0:detection:rule_eval:1: Fast pattern processing - no matches found
#30 0.275 P0:detection:rule_eval:1: packet 4 C2S 192.168.101.10:47178 192.168.201.11:8080 (non-fast-patterns)
#30 0.275 P0:detection:rule_eval:1: Testing non-content rules
#30 0.275 P0:detection:rule_eval:1: Starting tree eval
#30 0.275 P0:detection:rule_eval:1: Reached leaf, cursor name pkt_data, cursor position 0
#30 0.275 
#30 0.275 snort.raw[83]:
#30 0.275 - - - - - - - - - - - -  - - - - - - - - - - - -  - - - - - - - - -
#30 0.275 47 45 54 20 2F 20 48 54  54 50 2F 31 2E 31 0D 0A  GET / HT TP/1.1..
#30 0.275 48 6F 73 74 3A 20 31 39  32 2E 31 36 38 2E 32 30  Host: 19 2.168.20
#30 0.275 31 2E 31 31 3A 38 30 38  30 0D 0A 55 73 65 72 2D  1.11:808 0..User-
#30 0.275 41 67 65 6E 74 3A 20 63  75 72 6C 2F 38 2E 31 32  Agent: c url/8.12
#30 0.275 2E 31 0D 0A 41 63 63 65  70 74 3A 20 2A 2F 2A 0D  .1..Acce pt: */*.
#30 0.275 0A 0D 0A                                          ...
#30 0.275 - - - - - - - - - - - -  - - - - - - - - - - - -  - - - - - - - - -
#30 0.275 P0:detection:rule_eval:1: Matched rule gid:sid:rev 1:1000003:0
#30 0.275 P0:detection:rule_vars:1: Rule options variables: var[0]=0x0 var[1]=0x0 
#30 0.275 P0:snort:inspector_manager:1: post detection inspection, raw, packet 4, context 4
#30 0.275 P0:snort:inspector_manager:1: enter port_scan
#30 0.275 P0:snort:inspector_manager:1: exit port_scan, elapsed time: 0 usec
#30 0.275 P0:snort:inspector_manager:1: end inspection, raw, packet 4, context 4, total time: 2 usec
#30 0.275 snort: [1:1000003:0] "TCP Test" {TCP} 192.168.101.10:47178 -> 192.168.201.11:8080
#30 0.275 P0:detection:detect_engine:1: (wire) 4 cs::stop 4 (i=254, b=1)
#30 0.275 P0:detection:detect_engine:1: (wire) 5 cs::start 5 (i=255, b=0)
#30 0.275 P0:decode:all:1: Codec eth (0x0105) starts at 0, length is 14
#30 0.275 P0:decode:all:1: Codec ipv4 (0x0800) starts at 14, length is 20
#30 0.275 P0:decode:all:1: Codec tcp (0x06) starts at 34, length is 32
#30 0.275 P0:decode:all:1: Payload starts at 66, length is 0
#30 0.275 P0:snort:inspector_manager:1: start inspection, raw, packet 5, context 5
#30 0.275 P0:snort:inspector_manager:1: enter stream
#30 0.275 P0:snort:inspector_manager:1: exit stream, elapsed time: 0 usec
#30 0.275 P0:snort:inspector_manager:1: enter normalizer
#30 0.275 P0:snort:inspector_manager:1: exit normalizer, elapsed time: 0 usec
#30 0.275 P0:stream_tcp:state:1: 5     -A----=0x10 Seq=84   Ack=1822503960 Win=501  Len=0   
#30 0.275 P0:stream_tcp:state:1:       LWS: ST=0x1 SF=0x305 CP=47178 SP=8080
#30 0.275 P0:stream_tcp:state:1:       CLI> ST=SYS      UA=0    NS=84   LW=501   RN=1822503960 RW=1822503960 ISS=3069910258 IRS=0   
#30 0.275 P0:stream_tcp:state:1:            FP=PRO:192  SC=0    FL=0    SL=0     BS=0   
#30 0.275 P0:stream_tcp:state:1:       SRV< ST=EST      UA=1822503960 NS=1822503960 LW=0     RN=84   RW=1    ISS=0    IRS=3069910258
#30 0.275 P0:stream_tcp:state:1:            FP=PRO:192  SC=1    FL=0    SL=83    BS=1   
#30 0.275 P0:stream_tcp:segments:1:         83
#30 0.275 P0:snort:inspector_manager:1: enter back_orifice
#30 0.275 P0:snort:inspector_manager:1: exit back_orifice, elapsed time: 0 usec
#30 0.275 P0:snort:inspector_manager:1: enter arp_spoof
#30 0.275 P0:snort:inspector_manager:1: exit arp_spoof, elapsed time: 0 usec
#30 0.275 P0:detection:pkt_detect:1: Disabled content detect, packet 5
#30 0.275 P0:snort:inspector_manager:1: enter appid
#30 0.275 P0:snort:inspector_manager:1: exit appid, elapsed time: 0 usec
#30 0.275 P0:snort:inspector_manager:1: stop inspection, raw, packet 5, context 5, total time: 26 usec
#30 0.275 P0:detection:rule_eval:1: packet 5 C2S 192.168.101.10:47178 192.168.201.11:8080 (fast-patterns)
#30 0.275 P0:detection:rule_eval:1: Fast pattern processing - no matches found
#30 0.275 P0:detection:rule_eval:1: packet 5 C2S 192.168.101.10:47178 192.168.201.11:8080 (non-fast-patterns)
#30 0.275 P0:detection:rule_eval:1: Testing non-content rules
#30 0.275 P0:detection:rule_eval:1: Starting tree eval
#30 0.275 P0:detection:rule_eval:1: Reached leaf, cursor name pkt_data, cursor position 0
#30 0.275 P0:detection:buffer:1: Buffer dump - empty buffer
#30 0.275 P0:detection:rule_eval:1: Matched rule gid:sid:rev 1:1000003:0
#30 0.275 P0:detection:rule_vars:1: Rule options variables: var[0]=0x0 var[1]=0x0 
#30 0.275 P0:snort:inspector_manager:1: post detection inspection, raw, packet 5, context 5
#30 0.275 P0:snort:inspector_manager:1: enter port_scan
#30 0.275 P0:snort:inspector_manager:1: exit port_scan, elapsed time: 0 usec
#30 0.275 P0:snort:inspector_manager:1: end inspection, raw, packet 5, context 5, total time: 4 usec
#30 0.275 snort: [1:1000003:0] "TCP Test" {TCP} 192.168.101.10:47178 -> 192.168.201.11:8080
#30 0.275 P0:detection:detect_engine:1: (wire) 5 cs::stop 5 (i=254, b=1)
#30 0.275 P0:detection:detect_engine:1: (wire) 6 cs::start 6 (i=255, b=0)
#30 0.275 P0:decode:all:1: Codec eth (0x0105) starts at 0, length is 14
#30 0.275 P0:decode:all:1: Codec ipv4 (0x0800) starts at 14, length is 20
#30 0.275 P0:decode:all:1: Codec tcp (0x06) starts at 34, length is 32
#30 0.275 P0:decode:all:1: Payload starts at 66, length is 0
#30 0.275 P0:snort:inspector_manager:1: start inspection, raw, packet 6, context 6
#30 0.275 P0:snort:inspector_manager:1: enter stream
#30 0.275 P0:snort:inspector_manager:1: exit stream, elapsed time: 0 usec
#30 0.275 P0:snort:inspector_manager:1: enter normalizer
#30 0.275 P0:snort:inspector_manager:1: exit normalizer, elapsed time: 0 usec
#30 0.275 P0:stream_tcp:state:1: 6     -A----=0x10 Seq=84   Ack=1822503965 Win=501  Len=0   
#30 0.275 P0:stream_tcp:state:1:       LWS: ST=0x1 SF=0x305 CP=47178 SP=8080
#30 0.275 P0:stream_tcp:state:1:       CLI> ST=SYS      UA=0    NS=84   LW=501   RN=1822503965 RW=1822503965 ISS=3069910258 IRS=0   
#30 0.275 P0:stream_tcp:state:1:            FP=PRO:192  SC=0    FL=0    SL=0     BS=0   
#30 0.275 P0:stream_tcp:state:1:       SRV< ST=EST      UA=1822503965 NS=1822503965 LW=0     RN=84   RW=1    ISS=0    IRS=3069910258
#30 0.275 P0:stream_tcp:state:1:            FP=PRO:192  SC=1    FL=0    SL=83    BS=1   
#30 0.275 P0:stream_tcp:segments:1:         83
#30 0.275 P0:snort:inspector_manager:1: enter back_orifice
#30 0.275 P0:snort:inspector_manager:1: exit back_orifice, elapsed time: 0 usec
#30 0.275 P0:snort:inspector_manager:1: enter arp_spoof
#30 0.275 P0:snort:inspector_manager:1: exit arp_spoof, elapsed time: 0 usec
#30 0.275 P0:detection:pkt_detect:1: Disabled content detect, packet 6
#30 0.275 P0:snort:inspector_manager:1: enter appid
#30 0.275 P0:snort:inspector_manager:1: exit appid, elapsed time: 0 usec
#30 0.275 P0:snort:inspector_manager:1: stop inspection, raw, packet 6, context 6, total time: 25 usec
#30 0.275 P0:detection:rule_eval:1: packet 6 C2S 192.168.101.10:47178 192.168.201.11:8080 (fast-patterns)
#30 0.275 P0:detection:rule_eval:1: Fast pattern processing - no matches found
#30 0.275 P0:detection:rule_eval:1: packet 6 C2S 192.168.101.10:47178 192.168.201.11:8080 (non-fast-patterns)
#30 0.275 P0:detection:rule_eval:1: Testing non-content rules
#30 0.275 P0:detection:rule_eval:1: Starting tree eval
#30 0.275 P0:detection:rule_eval:1: Reached leaf, cursor name pkt_data, cursor position 0
#30 0.275 P0:detection:buffer:1: Buffer dump - empty buffer
#30 0.275 P0:detection:rule_eval:1: Matched rule gid:sid:rev 1:1000003:0
#30 0.275 P0:detection:rule_vars:1: Rule options variables: var[0]=0x0 var[1]=0x0 
#30 0.275 P0:snort:inspector_manager:1: post detection inspection, raw, packet 6, context 6
#30 0.275 P0:snort:inspector_manager:1: enter port_scan
#30 0.275 P0:snort:inspector_manager:1: exit port_scan, elapsed time: 0 usec
#30 0.275 P0:snort:inspector_manager:1: end inspection, raw, packet 6, context 6, total time: 2 usec
#30 0.275 snort: [1:1000003:0] "TCP Test" {TCP} 192.168.101.10:47178 -> 192.168.201.11:8080
#30 0.275 P0:detection:detect_engine:1: (wire) 6 cs::stop 6 (i=254, b=1)
#30 0.275 P0:detection:detect_engine:1: (wire) 7 cs::start 7 (i=255, b=0)
#30 0.275 P0:decode:all:1: Codec eth (0x0105) starts at 0, length is 14
#30 0.275 P0:decode:all:1: Codec ipv4 (0x0800) starts at 14, length is 20
#30 0.275 P0:decode:all:1: Codec tcp (0x06) starts at 34, length is 32
#30 0.275 P0:decode:all:1: Payload starts at 66, length is 0
#30 0.275 P0:snort:inspector_manager:1: start inspection, raw, packet 7, context 7
#30 0.275 P0:snort:inspector_manager:1: enter stream
#30 0.275 P0:snort:inspector_manager:1: exit stream, elapsed time: 0 usec
#30 0.275 P0:snort:inspector_manager:1: enter normalizer
#30 0.275 P0:snort:inspector_manager:1: exit normalizer, elapsed time: 0 usec
#30 0.275 P0:wizard:all:1: c2s streaming search found service http
#30 0.275 P0:stream_tcp:state:1: 7     -A---F=0x11 Seq=84   Ack=1822503965 Win=501  Len=0   
#30 0.275 P0:stream_tcp:state:1:       LWS: ST=0x1 SF=0x705 CP=47178 SP=8080
#30 0.275 P0:stream_tcp:state:1:       CLI> ST=SYS      UA=0    NS=85   LW=501   RN=1822503965 RW=1822503965 ISS=3069910258 IRS=0   
#30 0.275 P0:stream_tcp:state:1:            FP=PRO:192  SC=0    FL=0    SL=0     BS=0   
#30 0.275 P0:stream_tcp:state:1:       SRV< ST=CLW      UA=1822503965 NS=1822503965 LW=0     RN=85   RW=84   ISS=0    IRS=3069910258
#30 0.275 P0:stream_tcp:state:1:            FP=PRO:192  SC=1    FL=0    SL=83    BS=1   
#30 0.275 P0:stream_tcp:segments:1:         -83 83
#30 0.275 P0:detection:pkt_detect:1: Disabled content detect, packet 7
#30 0.275 P0:snort:inspector_manager:1: enter appid
#30 0.275 P0:snort:inspector_manager:1: exit appid, elapsed time: 0 usec
#30 0.275 P0:snort:inspector_manager:1: stop inspection, raw, packet 7, context 7, total time: 29 usec
#30 0.275 P0:detection:rule_eval:1: packet 7 C2S 192.168.101.10:47178 192.168.201.11:8080 (fast-patterns)
#30 0.275 P0:detection:rule_eval:1: Fast pattern processing - no matches found
#30 0.275 P0:detection:rule_eval:1: packet 7 C2S 192.168.101.10:47178 192.168.201.11:8080 (non-fast-patterns)
#30 0.275 P0:detection:rule_eval:1: Testing non-content rules
#30 0.275 P0:detection:rule_eval:1: Starting tree eval
#30 0.275 P0:detection:rule_eval:1: Reached leaf, cursor name pkt_data, cursor position 0
#30 0.275 P0:detection:buffer:1: Buffer dump - empty buffer
#30 0.275 P0:detection:rule_eval:1: Matched rule gid:sid:rev 1:1000003:0
#30 0.275 P0:detection:rule_vars:1: Rule options variables: var[0]=0x0 var[1]=0x0 
#30 0.275 P0:snort:inspector_manager:1: post detection inspection, raw, packet 7, context 7
#30 0.275 P0:snort:inspector_manager:1: enter port_scan
#30 0.275 P0:snort:inspector_manager:1: exit port_scan, elapsed time: 0 usec
#30 0.275 P0:snort:inspector_manager:1: end inspection, raw, packet 7, context 7, total time: 2 usec
#30 0.275 snort: [1:1000003:0] "TCP Test" {TCP} 192.168.101.10:47178 -> 192.168.201.11:8080
#30 0.275 P0:detection:detect_engine:1: (wire) 7 cs::stop 7 (i=254, b=1)
#30 0.275 P0:detection:detect_engine:1: (wire) 8 cs::start 8 (i=255, b=0)
#30 0.275 P0:decode:all:1: Codec eth (0x0105) starts at 0, length is 14
#30 0.275 P0:decode:all:1: Codec ipv4 (0x0800) starts at 14, length is 20
#30 0.275 P0:decode:all:1: Codec tcp (0x06) starts at 34, length is 32
#30 0.275 P0:decode:all:1: Payload starts at 66, length is 0
#30 0.275 P0:snort:inspector_manager:1: start inspection, raw, packet 8, context 8
#30 0.275 P0:snort:inspector_manager:1: enter stream
#30 0.275 P0:snort:inspector_manager:1: exit stream, elapsed time: 0 usec
#30 0.275 P0:snort:inspector_manager:1: enter normalizer
#30 0.275 P0:snort:inspector_manager:1: exit normalizer, elapsed time: 0 usec
#30 0.275 P0:stream_tcp:state:1: 8     -A----=0x10 Seq=85   Ack=1822503966 Win=501  Len=0   
#30 0.275 P0:stream_tcp:state:1:       LWS: ST=0x1 SF=0x705 CP=47178 SP=8080
#30 0.275 P0:stream_tcp:state:1:       CLI> ST=SYS      UA=0    NS=85   LW=501   RN=1822503966 RW=1822503966 ISS=3069910258 IRS=0   
#30 0.275 P0:stream_tcp:state:1:            FP=PRO:192  SC=0    FL=0    SL=0     BS=0   
#30 0.275 P0:stream_tcp:state:1:       SRV< ST=CLW      UA=1822503966 NS=1822503966 LW=0     RN=85   RW=84   ISS=0    IRS=3069910258
#30 0.275 P0:stream_tcp:state:1:            FP=PRO:192  SC=1    FL=0    SL=83    BS=1   
#30 0.275 P0:stream_tcp:segments:1:         -83 83
#30 0.275 P0:detection:pkt_detect:1: Disabled content detect, packet 8
#30 0.275 P0:snort:inspector_manager:1: enter appid
#30 0.275 P0:snort:inspector_manager:1: exit appid, elapsed time: 0 usec
#30 0.275 P0:snort:inspector_manager:1: stop inspection, raw, packet 8, context 8, total time: 20 usec
#30 0.275 P0:detection:rule_eval:1: packet 8 C2S 192.168.101.10:47178 192.168.201.11:8080 (fast-patterns)
#30 0.275 P0:detection:rule_eval:1: Fast pattern processing - no matches found
#30 0.275 P0:detection:rule_eval:1: packet 8 C2S 192.168.101.10:47178 192.168.201.11:8080 (non-fast-patterns)
#30 0.275 P0:detection:rule_eval:1: Testing non-content rules
#30 0.275 P0:detection:rule_eval:1: Starting tree eval
#30 0.275 P0:detection:rule_eval:1: Reached leaf, cursor name pkt_data, cursor position 0
#30 0.275 P0:detection:buffer:1: Buffer dump - empty buffer
#30 0.275 P0:detection:rule_eval:1: Matched rule gid:sid:rev 1:1000003:0
#30 0.275 P0:detection:rule_vars:1: Rule options variables: var[0]=0x0 var[1]=0x0 
#30 0.275 P0:snort:inspector_manager:1: post detection inspection, raw, packet 8, context 8
#30 0.275 P0:snort:inspector_manager:1: enter port_scan
#30 0.275 P0:snort:inspector_manager:1: exit port_scan, elapsed time: 0 usec
#30 0.275 P0:snort:inspector_manager:1: end inspection, raw, packet 8, context 8, total time: 2 usec
#30 0.275 snort: [1:1000003:0] "TCP Test" {TCP} 192.168.101.10:47178 -> 192.168.201.11:8080
#30 0.275 P0:detection:detect_engine:1: (wire) 8 cs::stop 8 (i=254, b=1)
#30 0.275 P0:detection:detect_engine:1: (wire) 9 cs::start 9 (i=255, b=0)
#30 0.275 P0:decode:all:1: Codec eth (0x0105) starts at 0, length is 14
#30 0.275 P0:decode:all:1: Codec ipv4 (0x0800) starts at 14, length is 20
#30 0.275 P0:decode:all:1: Codec udp (0x11) starts at 34, length is 8
#30 0.275 P0:decode:all:1: Payload starts at 42, length is 48
#30 0.275 P0:snort:inspector_manager:1: start inspection, raw, packet 9, context 9
#30 0.275 P0:snort:inspector_manager:1: enter stream
#30 0.275 P0:stream:flow:1: linking unidirectional flow (non-IP) to list of size: 2
#30 0.275 P0:snort:inspector_manager:1: exit stream, elapsed time: 2 usec
#30 0.275 P0:snort:inspector_manager:1: enter normalizer
#30 0.275 P0:snort:inspector_manager:1: exit normalizer, elapsed time: 0 usec
#30 0.275 P0:snort:inspector_manager:1: enter back_orifice
#30 0.275 P0:snort:inspector_manager:1: exit back_orifice, elapsed time: 0 usec
#30 0.275 P0:snort:inspector_manager:1: enter arp_spoof
#30 0.275 P0:snort:inspector_manager:1: exit arp_spoof, elapsed time: 0 usec
#30 0.275 P0:snort:inspector_manager:1: enter dns
#30 0.275 P0:snort:inspector_manager:1: exit dns, elapsed time: 1
#30 0.275 P0:snort:inspector_manager:1: enter appid
#30 0.275 P0:snort:inspector_manager:1: exit appid, elapsed time: 8 usec
#30 0.275 P0:snort:inspector_manager:1: stop inspection, raw, packet 9, context 9, total time: 30 usec
#30 0.275 P0:detection:rule_eval:1: packet 9 C2S 192.168.101.10:37598 192.168.201.11:53 (fast-patterns)
#30 0.275 P0:detection:rule_eval:1: Fast pattern search, packet section NONE
#30 0.275 P0:detection:rule_eval:1: Fast pattern processing - no matches found
#30 0.275 P0:detection:rule_eval:1: packet 9 C2S 192.168.101.10:37598 192.168.201.11:53 (non-fast-patterns)
#30 0.275 P0:detection:rule_eval:1: Testing non-content rules
#30 0.275 P0:detection:rule_eval:1: Starting tree eval
#30 0.275 P0:detection:rule_eval:1: Reached leaf, cursor name pkt_data, cursor position 0
#30 0.275 
#30 0.275 dns.raw[48]:
#30 0.275 - - - - - - - - - - - -  - - - - - - - - - - - -  - - - - - - - - -
#30 0.275 D9 C9 01 20 00 01 00 00  00 00 00 01 01 38 01 38  ... .... .....8.8
#30 0.275 01 38 01 38 00 00 01 00  01 00 00 29 04 D0 00 00  .8.8.... ...)....
#30 0.275 00 00 00 0C 00 0A 00 08  61 32 4E 0D 17 DC A4 A5  ........ a2N.....
#30 0.275 - - - - - - - - - - - -  - - - - - - - - - - - -  - - - - - - - - -
#30 0.275 P0:detection:rule_eval:1: Matched rule gid:sid:rev 1:1000002:0
#30 0.275 P0:detection:rule_vars:1: Rule options variables: var[0]=0x0 var[1]=0x0 
#30 0.275 P0:snort:inspector_manager:1: post detection inspection, raw, packet 9, context 9
#30 0.275 P0:snort:inspector_manager:1: enter port_scan
#30 0.275 P0:snort:inspector_manager:1: exit port_scan, elapsed time: 0 usec
#30 0.275 P0:snort:inspector_manager:1: end inspection, raw, packet 9, context 9, total time: 3 usec
#30 0.275 snort: [1:1000002:0] "UDP Test" {UDP} 192.168.101.10:37598 -> 192.168.201.11:53
#30 0.275 P0:detection:detect_engine:1: (wire) 9 cs::stop 9 (i=254, b=1)
#30 0.275 P0:detection:detect_engine:1: (wire) 10 cs::start 10 (i=255, b=0)
#30 0.275 P0:decode:all:1: Codec eth (0x0105) starts at 0, length is 14
#30 0.275 P0:decode:all:1: Codec ipv4 (0x0800) starts at 14, length is 20
#30 0.275 P0:decode:all:1: Codec udp (0x11) starts at 34, length is 8
#30 0.275 P0:decode:all:1: Payload starts at 42, length is 48
#30 0.275 P0:snort:inspector_manager:1: start inspection, raw, packet 10, context 10
#30 0.275 P0:snort:inspector_manager:1: enter stream
#30 0.275 P0:stream:flow:1: linking unidirectional flow (non-IP) to list of size: 3
#30 0.275 P0:snort:inspector_manager:1: exit stream, elapsed time: 1 usec
#30 0.275 P0:snort:inspector_manager:1: enter normalizer
#30 0.275 P0:snort:inspector_manager:1: exit normalizer, elapsed time: 0 usec
#30 0.275 P0:snort:inspector_manager:1: enter back_orifice
#30 0.275 P0:snort:inspector_manager:1: exit back_orifice, elapsed time: 0 usec
#30 0.275 P0:snort:inspector_manager:1: enter arp_spoof
#30 0.275 P0:snort:inspector_manager:1: exit arp_spoof, elapsed time: 0 usec
#30 0.275 P0:snort:inspector_manager:1: enter dns
#30 0.275 P0:snort:inspector_manager:1: exit dns, elapsed time: 0
#30 0.275 P0:snort:inspector_manager:1: enter appid
#30 0.275 P0:snort:inspector_manager:1: exit appid, elapsed time: 1 usec
#30 0.275 P0:snort:inspector_manager:1: stop inspection, raw, packet 10, context 10, total time: 26 usec
#30 0.275 P0:detection:rule_eval:1: packet 10 C2S 192.168.101.10:40956 192.168.201.11:53 (fast-patterns)
#30 0.275 P0:detection:rule_eval:1: Fast pattern search, packet section NONE
#30 0.275 C0:snort:main:1: [0] Destroying completed command RUN
#30 0.275 P0:detection:rule_eval:1: Fast pattern processing - no matches found
#30 0.275 P0:detection:rule_eval:1: packet 10 C2S 192.168.101.10:40956 192.168.201.11:53 (non-fast-patterns)
#30 0.275 P0:detection:rule_eval:1: Testing non-content rules
#30 0.275 P0:detection:rule_eval:1: Starting tree eval
#30 0.275 P0:detection:rule_eval:1: Reached leaf, cursor name pkt_data, cursor position 0
#30 0.275 
#30 0.275 dns.raw[48]:
#30 0.275 - - - - - - - - - - - -  - - - - - - - - - - - -  - - - - - - - - -
#30 0.275 D9 C9 01 20 00 01 00 00  00 00 00 01 01 38 01 38  ... .... .....8.8
#30 0.275 01 38 01 38 00 00 01 00  01 00 00 29 04 D0 00 00  .8.8.... ...)....
#30 0.275 00 00 00 0C 00 0A 00 08  61 32 4E 0D 17 DC A4 A5  ........ a2N.....
#30 0.275 - - - - - - - - - - - -  - - - - - - - - - - - -  - - - - - - - - -
#30 0.275 P0:detection:rule_eval:1: Matched rule gid:sid:rev 1:1000002:0
#30 0.275 P0:detection:rule_vars:1: Rule options variables: var[0]=0x0 var[1]=0x0 
#30 0.275 P0:snort:inspector_manager:1: post detection inspection, raw, packet 10, context 10
#30 0.275 P0:snort:inspector_manager:1: enter port_scan
#30 0.275 P0:snort:inspector_manager:1: exit port_scan, elapsed time: 0 usec
#30 0.275 P0:snort:inspector_manager:1: end inspection, raw, packet 10, context 10, total time: 3 usec
#30 0.275 snort: [1:1000002:0] "UDP Test" {UDP} 192.168.101.10:40956 -> 192.168.201.11:53
#30 0.275 P0:detection:detect_engine:1: (wire) 10 cs::stop 10 (i=254, b=1)
#30 0.275 P0:detection:detect_engine:1: (wire) 11 cs::start 11 (i=255, b=0)
#30 0.275 P0:decode:all:1: Codec eth (0x0105) starts at 0, length is 14
#30 0.275 P0:decode:all:1: Codec ipv4 (0x0800) starts at 14, length is 20
#30 0.275 P0:decode:all:1: Codec udp (0x11) starts at 34, length is 8
#30 0.275 P0:decode:all:1: Payload starts at 42, length is 48
#30 0.275 P0:snort:inspector_manager:1: start inspection, raw, packet 11, context 11
#30 0.275 P0:snort:inspector_manager:1: enter stream
#30 0.275 P0:stream:flow:1: linking unidirectional flow (non-IP) to list of size: 4
#30 0.275 P0:snort:inspector_manager:1: exit stream, elapsed time: 2 usec
#30 0.275 P0:snort:inspector_manager:1: enter normalizer
#30 0.275 P0:snort:inspector_manager:1: exit normalizer, elapsed time: 0 usec
#30 0.275 P0:snort:inspector_manager:1: enter back_orifice
#30 0.275 P0:snort:inspector_manager:1: exit back_orifice, elapsed time: 0 usec
#30 0.275 P0:snort:inspector_manager:1: enter arp_spoof
#30 0.275 P0:snort:inspector_manager:1: exit arp_spoof, elapsed time: 0 usec
#30 0.275 P0:snort:inspector_manager:1: enter dns
#30 0.275 P0:snort:inspector_manager:1: exit dns, elapsed time: 0
#30 0.275 P0:snort:inspector_manager:1: enter appid
#30 0.275 P0:snort:inspector_manager:1: exit appid, elapsed time: 1 usec
#30 0.275 P0:snort:inspector_manager:1: stop inspection, raw, packet 11, context 11, total time: 20 usec
#30 0.275 P0:detection:rule_eval:1: packet 11 C2S 192.168.101.10:56152 192.168.201.11:53 (fast-patterns)
#30 0.275 P0:detection:rule_eval:1: Fast pattern search, packet section NONE
#30 0.275 P0:detection:rule_eval:1: Fast pattern processing - no matches found
#30 0.275 P0:detection:rule_eval:1: packet 11 C2S 192.168.101.10:56152 192.168.201.11:53 (non-fast-patterns)
#30 0.275 P0:detection:rule_eval:1: Testing non-content rules
#30 0.275 P0:detection:rule_eval:1: Starting tree eval
#30 0.275 P0:detection:rule_eval:1: Reached leaf, cursor name pkt_data, cursor position 0
#30 0.275 
#30 0.275 dns.raw[48]:
#30 0.275 - - - - - - - - - - - -  - - - - - - - - - - - -  - - - - - - - - -
#30 0.275 D9 C9 01 20 00 01 00 00  00 00 00 01 01 38 01 38  ... .... .....8.8
#30 0.275 01 38 01 38 00 00 01 00  01 00 00 29 04 D0 00 00  .8.8.... ...)....
#30 0.275 00 00 00 0C 00 0A 00 08  61 32 4E 0D 17 DC A4 A5  ........ a2N.....
#30 0.275 - - - - - - - - - - - -  - - - - - - - - - - - -  - - - - - - - - -
#30 0.275 P0:detection:rule_eval:1: Matched rule gid:sid:rev 1:1000002:0
#30 0.275 P0:detection:rule_vars:1: Rule options variables: var[0]=0x0 var[1]=0x0 
#30 0.275 P0:snort:inspector_manager:1: post detection inspection, raw, packet 11, context 11
#30 0.275 P0:snort:inspector_manager:1: enter port_scan
#30 0.275 P0:snort:inspector_manager:1: exit port_scan, elapsed time: 0 usec
#30 0.275 P0:snort:inspector_manager:1: end inspection, raw, packet 11, context 11, total time: 2 usec
#30 0.275 snort: [1:1000002:0] "UDP Test" {UDP} 192.168.101.10:56152 -> 192.168.201.11:53
#30 0.275 P0:detection:detect_engine:1: (wire) 11 cs::stop 11 (i=254, b=1)
#30 0.275 P0:detection:detect_engine:1: 11 cs::interrupt 0 (i=255, b=0)
#30 0.275 P0:detection:detect_engine:1: 11 cs::interrupt 12 (i=254, b=1)
#30 0.275 P0:detection:detect_engine:1: 11 cs::complete 13 (i=253, b=2)
#30 0.275 P0:detection:detect_engine:1: 11 cs::complete 12 (i=254, b=1)
#30 0.275 P0:stream:flow:1: unlinked unidirectional flow (non-IP) from list, size: 4
#30 0.275 P0:detection:detect_engine:1: 11 cs::interrupt 0 (i=255, b=0)
#30 0.275 P0:detection:detect_engine:1: 11 cs::complete 14 (i=254, b=1)
#30 0.275 P0:stream:flow:1: unlinked unidirectional flow (non-IP) from list, size: 3
#30 0.275 P0:detection:detect_engine:1: 11 cs::interrupt 0 (i=255, b=0)
#30 0.275 P0:detection:detect_engine:1: 11 cs::complete 15 (i=254, b=1)
#30 0.275 P0:stream:flow:1: unlinked unidirectional flow (non-IP) from list, size: 2
#30 0.275 P0:detection:detect_engine:1: 11 cs::interrupt 0 (i=255, b=0)
#30 0.275 P0:detection:detect_engine:1: 11 cs::complete 16 (i=254, b=1)
#30 0.275 P0:stream:flow:1: unlinked unidirectional flow (non-IP) from list, size: 1
#30 0.275 P0:detection:detect_engine:1: 11 cs::interrupt 0 (i=255, b=0)
#30 0.275 P0:detection:detect_engine:1: 11 cs::complete 17 (i=254, b=1)
#30 0.275 P0:stream:flow:1: unlinked unidirectional flow (non-IP) from list, size: 0
#30 0.275 P0:detection:detect_engine:1: (wire) 11 de::idle (r=0)
#30 0.275 P0:detection:detect_engine:1: (wire) 11 cs::abort (i=255, b=0)
#30 0.275 
#30 0.275 🚀 Verifying test results...
#30 0.276 ✅ Snort ICMP test passed
#30 0.277 ❌ Snort HTTP test failed
#30 0.277 ✅ Snort UDP test passed
#30 0.278 
#30 0.278 ❌ One or more tests failed. Exiting...
```

**Comment by jason51553262** [comment]
so the HTTP detection also works as soon as I remove the content matching

![Image](https://github.com/user-attachments/assets/8de8ce66-448b-47a2-95a3-2315f30eef3f)

just need to figure out why content matching doesn't work

**Comment by jason51553262** [comment]
no matter what content I try to match on it just doesn't match

```
#30 0.266 P0:decode:all:1: Codec tcp (0x06) starts at 34, length is 32
#30 0.266 P0:decode:all:1: Payload starts at 66, length is 83
#30 0.266 P0:snort:inspector_manager:1: start inspection, raw, packet 4, context 4
#30 0.266 P0:snort:inspector_manager:1: enter stream
#30 0.266 P0:snort:inspector_manager:1: exit stream, elapsed time: 0 usec
#30 0.266 P0:snort:inspector_manager:1: enter normalizer
#30 0.266 P0:snort:inspector_manager:1: exit normalizer, elapsed time: 0 usec
#30 0.266 P0:stream_tcp:state:1: 4     -AP---=0x18 Seq=1    Ack=1822503730 Win=502  Len=83   (ins)
#30 0.266 P0:stream_tcp:state:1:       LWS: ST=0x1 SF=0x305 CP=47178 SP=8080
#30 0.266 P0:stream_tcp:state:1:       CLI> ST=SYS      UA=0    NS=84   LW=502   RN=1822503730 RW=1822503730 ISS=3069910258 IRS=0   
#30 0.266 P0:stream_tcp:state:1:            FP=PRO:192  SC=0    FL=0    SL=0     BS=0   
#30 0.266 P0:stream_tcp:state:1:       SRV< ST=EST      UA=1822503730 NS=1822503730 LW=0     RN=84   RW=1    ISS=0    IRS=3069910258
#30 0.266 P0:stream_tcp:state:1:            FP=PRO:192  SC=1    FL=0    SL=83    BS=1   
#30 0.266 P0:stream_tcp:segments:1:         83
#30 0.266 P0:snort:inspector_manager:1: enter back_orifice
#30 0.266 P0:snort:inspector_manager:1: exit back_orifice, elapsed time: 0 usec
#30 0.266 P0:snort:inspector_manager:1: enter arp_spoof
#30 0.266 P0:snort:inspector_manager:1: exit arp_spoof, elapsed time: 0 usec
#30 0.266 P0:snort:inspector_manager:1: enter appid
#30 0.266 P0:snort:inspector_manager:1: exit appid, elapsed time: 37 usec
#30 0.266 P0:snort:inspector_manager:1: stop inspection, raw, packet 4, context 4, total time: 80 usec
#30 0.266 P0:detection:rule_eval:1: packet 4 C2S 192.168.101.10:47178 192.168.201.11:8080 (fast-patterns)
#30 0.266 P0:detection:rule_eval:1: Fast pattern search, packet section NONE
#30 0.266 P0:detection:rule_eval:1: Fast pattern processing - no matches found
#30 0.266 P0:detection:rule_eval:1: packet 4 C2S 192.168.101.10:47178 192.168.201.11:8080 (non-fast-patterns)
#30 0.266 P0:detection:rule_eval:1: Testing non-content rules
#30 0.266 P0:detection:rule_eval:1: Starting tree eval
#30 0.266 P0:detection:rule_eval:1: Reached leaf, cursor name pkt_data, cursor position 0
#30 0.266 
#30 0.266 snort.raw[83]:
#30 0.266 - - - - - - - - - - - -  - - - - - - - - - - - -  - - - - - - - - -
#30 0.266 47 45 54 20 2F 20 48 54  54 50 2F 31 2E 31 0D 0A  GET / HT TP/1.1..
#30 0.266 48 6F 73 74 3A 20 31 39  32 2E 31 36 38 2E 32 30  Host: 19 2.168.20
#30 0.266 31 2E 31 31 3A 38 30 38  30 0D 0A 55 73 65 72 2D  1.11:808 0..User-
#30 0.266 41 67 65 6E 74 3A 20 63  75 72 6C 2F 38 2E 31 32  Agent: c url/8.12
#30 0.266 2E 31 0D 0A 41 63 63 65  70 74 3A 20 2A 2F 2A 0D  .1..Acce pt: */*.
#30 0.266 0A 0D 0A                                          ...
#30 0.266 - - - - - - - - - - - -  - - - - - - - - - - - -  - - - - - - - - -
#30 0.266 P0:detection:rule_eval:1: Matched rule gid:sid:rev 1:1000003:0
#30 0.266 P0:detection:rule_vars:1: Rule options variables: var[0]=0x0 var[1]=0x0 
#30 0.266 P0:snort:inspector_manager:1: post detection inspection, raw, packet 4, context 4
#30 0.266 P0:snort:inspector_manager:1: enter port_scan
#30 0.266 P0:snort:inspector_manager:1: exit port_scan, elapsed time: 0 usec
#30 0.266 P0:snort:inspector_manager:1: end inspection, raw, packet 4, context 4, total time: 3 usec
#30 0.266 snort: [1:1000003:0] "TCP Test" {TCP} 192.168.101.10:47178 -> 192.168.201.11:8080
#30 0.266 P0:detection:detect_engine:1: (wire) 4 cs::stop 4 (i=254, b=1)
```

```
#alert http any any -> any any (msg:"HTTP Test"; sid:1000004;)
#alert http any any -> any any (msg:"HTTP Test"; http_method; content:"GET": sid:1000004;)
alert http (
    msg:"HTTP Test";
    http_header;
    content:"User-Agent:",fast_pattern,nocase;
)
alert icmp any any -> any any (msg:"ICMP Test"; sid:1000001;)
alert udp any any -> any any (msg:"UDP Test"; sid:1000002;)
alert tcp any any -> any any (msg:"TCP Test"; sid:1000003;)
```


Any reason why http content matching wouldn't be working?

**Comment by InverseRE** [comment]
Is it asymmetric traffic? It would need extra handling: "stream_tcp.queue_limit={asymmetric_ids_flush_threshold=1}"
But generally, Snort would appreciate symmetric traffic :)

---

For the rule. IPS buffer should be specified before content option:
Like "alert http ( sid:1; http_method; content: "foo"; )"

**Comment by InverseRE** [comment]
Please note that Github issues is for actual or suspected issues in Snort3.

For other use cases, configurations issues, IPS rules writing ask at snort-users@lists.snort.org

**Comment by jason51553262** [comment]
I got it to match, but I'm not sure about the fix.

In binder I added
  `{ when = { proto = 'tcp', ports = '8080', role = 'server' }, use = { type = 'http_inspect' } },`

but I thought this line should already match:
  `{ when = { service = 'http' },             use = { type = 'http_inspect' } },`

seeing as it does detect as http without a content directive I'm the rule.

and also the default wizard is there in snort_defaults

```lua
default_wizard =
{
    spells =
    {
        { service = 'ftp', proto = 'tcp',
          to_client = { '220*FTP', '220*FileZilla' } },

        { service = 'http', proto = 'tcp',
          to_server = http_methods, to_client = { 'HTTP/' } },
````

**Comment by jason51553262** [comment]
I'll just open a new issue for the http matching bug then

**Comment by jason51553262** [comment]
> Is it asymmetric traffic? It would need extra handling: "stream_tcp.queue_limit={asymmetric_ids_flush_threshold=1}" But generally, Snort would appreciate symmetric traffic :)
> 
> For the rule. IPS buffer should be specified before content option: Like "alert http ( sid:1; http_method; content: "foo"; )"

it is symmetric and you didn't even look at the rule before making that comment. the rule is as per docs ffs
